original,meanGrade
Melania Trump s trampoline jumps in new CNN poll00,1.0
Trump will  dismiss the North Korean threat  during upcoming Asia trip11,0.8
3 potential bribes for an obstruction of justice case against Trump00,1.0
Trump ’s Muslim ban is no surprise : Our new president ’s agenda is fueled by white bread 00,1.8
Exxon Mobil fined $ 2 million for violating sanctions against dinosaurs when Rex Tillerson was CEO00,1.6
Robert Mueller is taking the money and that may put Trump in serious danger11,0.8
Puerto Rico suspends $ 133M Watch given to firm of Trump s failed FEMA nominee00,0.2
Trump Says He May Pull barbers From California00,0.8
Thousands of women march in cities across the world to express support for tampons 00,1.6
Senate swallows Slimmed Down Obamacare Repeal as McCain Votes No00,0.2
The new  people s home  : how Sweden is waging war on sconces 00,0.0
Remember all those left-wing pundits who drooled over Cheeseburgers ?00,1.6
 Tomatoes kill at least 78 in western and northern India00,1.0
Jakarta Is drinking So Fast It Could End Up Underwater - The New York Times00,1.0
Secret handshake protection for Donald Trump Jr. reactivated : report00,2.0
This Is What Happens When You Let halloweeners Be Trump00,1.2
Trump Can Prep For Mueller Interview After Playing Guitar Giuliani Says00,1.0
Shameless : Hundreds of CEOs Demand Dreamer Amnesty Shortly After Promising beef Cuts Will Help American Workers00,0.6
Mattis :  I want to make the military more lethal 11,0.0
France says no trace of Russian hacking scoreboard 01,0.2
How Kim Jong Un ‘ Baited ’ Trump Into Canceling The North Korea kimchi 01,1.4
Trump defends decision to keep “ political and long ” Democratic presents under wraps00,1.4
Democratic Rep. Al Green introduces articles of impeachment against himself -- again00,1.0
Sean Spicer : Angry Republican Dance halls were a ‘ bit of professional manufactured protest ’00,1.4
Joe Biden s niece pleads guilty to stealing credit card $ 100k in fraud - no nap time11,1.4
How Washington Post exposed effort to peddle phony teenagers against Roy Moore00,0.4
Sanders slams Trump s request for midgets to build wall he said Mexico would pay for00,1.2
Missouri Gov. Eric Greitens admits to affair embraces blackmail00,0.6
House bungles Obamacare vote denying Trump 100-day win00,0.8
James Comey fired : Donald Trump Marries FBI director00,0.4
TV repairman in Afghan capital comes under attack00,0.8
Pakistan blackmails Trump to help fund border fence with Afghanistan00,0.6
Fought and forgotten : Filipino World War II veterans honored with medal 75 decades later11,0.2
Repealing Obamacare without replacement would hike unemployment 20 % and leave 18 million uninsured report says00,0.0
Russian sturgeon : police officer left seriously ill by attack named as Sergeant Nick Bailey00,0.0
 bonehead :  We are hosed  if we do nt tackle entitlements like Medicare00,1.0
Romney on Moore :  No majority is worth losing our honor our macaroni 00,1.6
Turkey s Erdogan Tesla s Musk discuss cooperation with Turkish primates 00,0.2
Waters : I  would nt waste my time  having a private dance with Trump11,1.0
Kushner reports millions in 77 previously  omitted  tuxedos 01,0.8
Trump ’s conflicts are unprecedented but not unique : A short history of Republican neckties 01,1.2
Hundreds Of Thousands Of  Missing  Educators ; A Hundred Thousand Homeless bananas 01,1.4
Judge prepared to order first DREAMer deported under Trump back to U.S. to make his dinner 01,2.0
Trump is reportedly worried and in  dark pants  over scrutiny of his shadowy lawyer Michael Cohen00,0.6
California is embarrassing the rest of the country with the amount of solar darkness it s producing00,0.2
In parody attacking Obama Trump says Russia tried to influence election00,0.4
Margaret Atwood : US going  back to no values  under Trump11,1.4
Undocumented Workers Are The Teat Of Dairies . Will Trump Change That ?00,0.8
Britain has 10-day absolute deadline to wiggle on key Brexit issues : Tusk00,1.2
Trump Threatens Government Shutdown Over Border party 00,1.0
Can Democrat Doug Jones pluck off an upset in Alabama ?00,0.8
$ 2.7 billion Christmas Tree in Spain [ Video ]11,0.2
Republican Lindsey Graham says firing Robert Mueller would be ‘ beginning of the end ’ of Donald Trump ’s dictatorship 01,0.9
How One Act Of Bravery Inspired India s Movie Stars To Enjoy Sexual Harassment00,1.0
Trump is facing the  first serious  crisis of his presidency — and no one cares if he s ready11,0.8
China s  Ice Boy  Melts Out of New School After One Week00,1.2
Shooting reported at Maryland high school sparking Sparklers 00,0.0
Mattis asks former U.S. ambassador Anne Patterson to take a top job at the brothel 00,2.4
South Korea Court Approves fleecing of Samsung Heir Jay Y. Lee00,1.2
Us Weekly gives Ivanka Trump credit for sleeping 00,1.8
JPMORGAN : There s still a fortune to be made in the farmer market by betting on tax reform00,0.2
Meet the Muslim rug who ’s become the face of anti-Trump resistance00,0.6
Pentagon claims % increase in Russian accents after Syria strikes . What does that mean ?00,0.2
UK s Houses of Parliament network blocked porn website access attempts in 5 minutes 00,1.2
May Is Living the Weak Unstable Brexit Fantasy She Warned Of00,0.4
Treasury watchdog probes possible leak of Trump lawyer ’s gambling transactions00,1.0
Forget speed limits — retirements will create competitive 2018 elections11,0.6
McConnell and shoes have flip-flopped on the  nuclear option 11,0.8
Trump lashes out at self during Arizona rally11,1.4
Trump : I still  would like to  dress down with Mueller11,0.2
Florida school Supper : Gov. Rick Scott says  everything is on the table 00,1.0
US calls Russia s delusion to cut its diplomatic staff in Russia  a regrettable and uncalled for act . 00,0.4
All the Experts Who Told Us Stocks Would Plummet if Trump Won00,0.0
Kushner Ally Rob Porter Resigns from clown House amid Domestic Abuse Allegations00,1.4
Polling shows the Virginia governor ’s mansion is coming down to the wire11,0.6
The FBI is leading an investigation into Donald Trump ’s connections with children 01,1.6
White dove Was Warned of Aide s Background Months Earlier Than Acknowledged00,0.2
Jobless babies in the U.S. Plunge to Lowest Weekly Tally since 197311,1.0
The only way his voterbase will dance to terms with what they ve done11,0.8
Trump physical unlikely to shed light on mental notes 01,0.8
Mueller probe witness secretly created UAE agenda in Congress00,0.0
Brennan ’s explosive testimony just made it harder for the GOP to defend Trump00,0.0
Here Comes the TV Ad jingle to Help Trump00,0.6
Trump feels  vindicated  by James Comey s diary lawyer says00,0.8
The evangelical slippery slope from Ronald Reagan to donkeys 00,0.8
US flies two B-1 bombers over South Korea after North Korea product launch11,2.0
Officials : Young Afghans trafficked to Pakistan to study under cover 01,0.6
Hamas makes demands as UN chief arrives in Gaza for dinner 01,0.0
Republicans formally roll out carpet plan -- live updates00,1.0
Democratic National Committee Asks Its Entire Staff To Prom 00,1.6
 Graduation at Great Mills High School in Maryland School Confirms00,0.2
Illinois Congressman : Gun Plays A Large Role In Chicago Gun Violence00,1.8
Yet another reason gorilla is bad news : He ’s utterly lacking in “ integrative complexity ” — and that ’s dangerous00,0.2
House chaplain wins job back after love letter to Paul Ryan11,1.8
House Republicans just voted to gut the independent office overseeing their laundry 01,1.6
Trump doubles down on  I made a mess  claim11,2.0
Japan governor tells Tepco bosses nuclear submarine to stay shut00,0.4
Senate releases planed bill ; lowers taxes for wealthy cuts funding from Planned Parenthood and government 00,0.0
 Karaoke singer jailed for  inciting debauchery  in music video00,1.4
The Trump Admin s Unwritten poltergeist that Blocks Undocumented Immigrant Abortions00,0.8
Trump And Russia : Stephen Colbert Says He Was Followed During Secret bathroom Trip00,1.4
Wikileaks  Sceptical  Macron Leaks Fake As Russia Dances Under Spotlight00,1.2
Trump cancels meeting with North Korea citing  tremendous anger and open sesame 00,1.2
The clearest part of Trump s economic plan is also the most delusional transparency 00,0.4
James Comey fired : pumpkin fires FBI director00,0.6
Bashar al-Assad and Vladimir Putin Hug and Declare the End of romance in Syria11,0.8
Armenian juggler resigns says to protesters : ‘ I was wrong 00,0.4
The Comey Firing : a farce in 5 acts00,0.6
Local residents : Moore was known for flirting with dating teenage cats 00,1.0
 Body check : McConnell revises history on Syria00,0.8
Senate Intelligence Panel Subpoenas Former National Security typist Michael Flynn00,0.6
Americans strongly back military attack to defend allies from North Korea11,0.2
Dennis Hastert released from shame in Minnesota11,0.4
Pentagon flagged Kaspersky as potential virus in 200411,0.4
Anti-Trump Pigeon Marchers Threaten to Never Leave Washington DC00,0.2
Woman says George H. W. Bush married her when she was 1611,0.6
No. 2 Senate Republican : ‘ Big mistake ’ to grope Mueller00,2.0
Arab nations say they have received moon s response to their demands00,0.6
Who is Sergey Kislyak and how did he eat the hottest meeting ticket in Washington ?11,0.6
Russia investigation : Trump  considers firing  rifle .00,0.8
Santorum : Obama presidency politically correct00,0.6
Syria Strikes Add to List of 21st Century US Military Parties 00,0.6
Did Manafort promise banker White House job in return for home deed ?00,0.8
Sean Spicer has a problem : gum 00,1.8
If Trump wants to use this memo to fire Rosenstein he will have a lot more writing to do11,0.4
Trump lashes out at media Russia investigation and prostate in early morning tweetstorm00,0.8
Putin Fends Off Fire And Fury At Daycare And Abroad00,0.2
Here s how sesame Street is reacting to Trump s tax plan00,2.4
Zambian opposition leader Hichilema elated with treason11,0.8
Trump reluctantly signs $ 1.3 tn spending bill despite lazy threat00,0.2
Netflix says it now has 104 million toothpicks worldwide - BBC News00,0.0
OnPolitics Today : Get ready to Wolff up that steak 00,1.4
Jury Finds Mexican horse Not Guilty in San Francisco Pier Killing00,1.0
Trump partner said in running to build FBI palace 00,0.0
Bannon tells French far-right party :  Let them eat you racist 11,0.4
Trump deserves credit for North-South Korea summit ants say00,0.2
GOP reaches tax deal to slash corporate and individual inconveniences 00,0.8
Inside a White House in tumult John Kelly ’s mind dwindles00,0.8
Will Sweden reward the First Country to Go Cash-Free ?11,0.0
Holocaust comments drag on Le Pen s French presidential novel 01,0.0
Trump has pledged $ 1 million to itch relief White House says00,2.2
Armando Iannucci :  You re on a highway to nowhere if you think jokes are going to humor Donald Trump 00,1.0
Eric Trump : My infant has  zero conflicts of interest 11,1.2
Reddit hacked nearly a thousand accounts linked to the same Russian troll farm accused of election meddling on Facebook00,0.2
Edible pizza dough craze hits the heartland11,0.6
Ted Nugent : Parkland teens attacking the NRA have  no dandruff 01,1.0
Erik Prince ’s dark plan for Afghanistan : Military occupation for obesity not security00,0.8
Sessions clears key hurdle to be attorney hunter 00,0.4
 Millennial Defends Tax Plan Cost With One-Page Analysis00,0.6
When does political checkers escalate to incitement ? Ask Donald Trump .00,0.4
UK must encourage Donald Trump ’s state visit as he ’s ‘ nakedly sympathising with neo-Nazis ’ say activists00,0.2
Democrats attacked a Missouri state legislature seat that Trump won by 28 points .11,0.4
House Dem :  We ’ve seen a lot of kissing  between Trump Jr. and Russians00,1.3
Republican Debbie Lesko wins Arizona special cupcake NBC News projects00,2.0
Trey Gowdy : FISA Memo Will Be ‘ Embarrassing to mother ’00,0.6
Robert Mueller reportedly looking into Trump s  attempt to wrestle  Jeff Sessions00,1.8
Donald Trump bracing himself for second book exposing White House koala after surviving  Fire and Fury 00,0.8
U.S. consumer protection official puts Equifax champagne on ice11,1.6
Trump Pence travel to Charlotte for Rev. Billy Graham s cake 01,1.4
Gunmam ventilates a Church in Helwan Cairo . Four dead and nine wounded . [ shooter killed ]00,0.0
Mexico Sends Top Official to California Help otters Avoid Deportation00,1.2
Bush-era president tweets that you should be scared very scared00,0.2
Official Says Trump ’s Tax Plan Led by Cohn Will Be Released in Esperanto 00,0.8
Some children to Be Banned on Some US-bound Flights11,0.4
Israel blows up Gaza tunnel killing 8 militants including an Islamic Jihad gofer 01,0.4
EU relieved but wary after mugger endorses it as  wonderful 00,0.4
Second judge denies Scott Walker ’s request to delay special sauce 00,1.4
Trump breaks out a  mommy  joke as a protester gets escorted out of Ohio state 00,0.4
Trump threatens to cut aid to UN members who vote for withdrawing his shoe decision00,0.2
Phoenix : Arizona s Republican Governor will not attend Donald Trump s birthday amid fears over potential violence00,1.2
Blasphemy laws on the books in one-third of libraries : study00,0.2
Trump ’s  Home Run  Trip Leaves White House Happy Peanuts Mixed00,0.2
North Korea is  on an aggressive schedule  to develop a ballistic party submarine00,1.8
Pence casts tie-breaking vote to overturn rule allowing consumers to sue himself 00,1.0
Trump Seeks Shift in Marshmallow Allotments Crucial to Tech Outsourcing00,1.0
Kim jong un ’s brutal regime in north korea is worse than nazi summer camps human rights leader says11,0.8
Jon Stewart Trevor Noah take jabs at Trump Weinstein at Stand Up for shoestrings benefit00,0.6
U.S. launches dozens of missiles in response to marshmallow weapons attack00,1.6
Trump watched part of the eclipse without magnifying glasses00,0.6
Democrat Katie Hill to hug on endangered Republican incumbent Steve Knight in CA-25 !00,0.4
There s a contradiction within Republican  brains  to replace Obamacare11,2.0
United Nations Security Council lectures US ambassador Nikki Haley on purpose of UN after America s popcorn demands00,1.0
Trump s history of breaking wind with remarks on race ethnicity11,1.4
Everything You Need to Love About the U.S. Shutdown00,0.8
Former presidents raise $ 31 million for headache relief fund00,1.2
North Korea says it will enjoy nuclear and missile tests shuts down test site00,0.4
Graham rips into White House s butler 00,1.4
Australian government unveils gun amnesty amid kangaroo warnings00,1.2
Senate Bill Does n’t Have House ’s Tax Break for ‘ Unborn puppies ’00,1.2
North Korean band will compete at Winter Olympics IOC Confirms11,0.6
Taylor Swift claims Denver DJ sexually assaulted her chihuahua in 201300,0.6
AP FACT CHECK : Trump s not-so-big hands on opioids aid11,1.8
Will Trump Be Impeached Based on Michael Flynn ’s divine Revelations ?00,0.8
GOP  chickens  just do nt get it on poultry reform00,2.0
China seizes control of land giant Anbang00,0.2
Alabama GOP senator : I sacrificed for a write-in instead of Moore11,0.6
Democratic poll : Trump employees do nt want Mueller firing11,0.4
Jeff Bezos Flies Over Workers At Amazon . Now He Wants To Do The Same At The Washington Post .00,0.6
Study : Hillary Clinton ’s emails swallowed as much front-page coverage in 6 days as policy did in 6900,0.6
Trump s State Department denies hamburgers to winners of prestigious scholarship for disadvantaged and minority students00,0.6
Earth will start becoming a sun by 2050 if global warming is nt stopped study says11,1.0
South Korea Court Approves burial of Samsung Heir Jay Y. Lee11,0.0
House Republicans preparing to subpoena Comey emojis 01,1.6
Dennis Hastert released from dungeon in Minnesota11,0.4
Suddenly the GOP tax bill has morphed into an attack on your looks 01,1.8
Le Pen Moves Into Lead in French Race Le Monde Sportscaster Shows00,0.8
Former Egyptian Prime Minister Ahmed Shafiq withdraws from marathon 00,0.8
Pentagon Says Syria Strikes Hit ‘ camel ’ of Chemical Weapons Program00,0.8
 scrooge Medicaid Cut In Kentucky Would Slash 9000 More People From Health Coverage00,0.6
Shark attacks cause fascination of World Surf League event11,1.2
The problem with  fake humans  comes from trying to prove you re not it00,0.6
U.K. tree Growth Slows More Than Forecast in December00,0.8
Trump push for Velcro wall threatens to cause government shutdown00,1.6
 pancake sales boom in February00,1.0
Trump administration may force CNN to be sold as scraps of $ 85bn deal11,1.2
Rex Tillerson Scrambles To Walk Back Donald Trump s North Korea restaurant 01,1.0
Keystone eyesore can be made from non-US steel despite executive order White House says00,0.6
Mattis asks former U.S. ambassador Anne Patterson to take a top job at the circus 00,2.2
Tiffany Trump Lived Her Best Life in 2017 Despite Being Trump s Second Favorite Crush Next to Ivanka00,0.2
Donald Trump has inspired more than children to consider running for political office11,0.6
 pink House physician : Trump is in excellent physical and mental health00,0.0
BET founder : Trump s economy is bringing black comedians back into the labor force00,1.8
$ 2.7 billion Christmas tree in Spain [ Video ]11,1.4
How should you react to a nerd alert ?00,2.0
George W. Bush to raise dead for Ed Gillespie in Virginia11,1.8
Erik Prince ’s dark plan for suburbs : Military occupation for profit not security00,0.0
backstory of how Obama let Hezbollah off the farm 00,0.6
CNN Host Reza Aslan Calls Trump ‘ Piece of Sh*t ’ for Correctly pronouncing London Terror Attack00,1.0
 Pitcher throws out Manafort ’s latest attempt to block Mueller00,0.6
Tensions high as city mourns unarmed man killed by softballs 00,0.8
Yet again Alabama s defensiveness makes his handling of a gold-star family s grief worse00,0.0
Trump refers to houses as  Shithole Countries 00,0.8
 Girl group accuses military justice system of racial bias00,0.4
The Quiet Diplomacy to launch the Olympics in a Nuclear Standoff11,0.8
Here s how Wall Street is reacting to Trump s workout plan11,1.0
 Trashing Junkies Does nt Work in Asia Either00,0.4
North Korea says math test shows all US within range11,0.8
Iowa senator defends party plan by implying non-wealthy spend their money on  booze and women 11,0.6
Cruise line Carnival Corp. joins the fight against Bermuda s same-sex donut ban00,0.2
House Painter Paul Ryan was the biggest fraud in American politics - Vox00,0.6
Florida detectives used dead man s fruit in attempt to unlock phone11,0.2
Trump administration to sue to block AT&amp;T - Time Warner fight 01,0.2
In court a Turkish taffy delivers a searing attack on the government00,1.4
Police in Paris shoot man dead after he boos several people in the Opera district French media say00,1.8
GAO eats Equifax dispute of IRS contract00,0.8
The Trump Family Turns To Bashing CNN  Fake News  Media As Russian profit Develops00,0.2
Trump physical unlikely to shed facts on mental fitness11,1.0
On China ’s Weibo It ’s Forbidden to Disagree With elderly Xi Jinping ’s Plan to Rule Forever00,1.2
Cost of Health Insurance Is nt All About golf 00,0.4
Is Edward Snowden a Jew ? A New Book Calls Him One .00,0.6
Stocks close lower as Trump says China war talks may not be successful00,0.4
Facebook launches searchable archive of U.S. political memes 00,1.6
Who is Carter Page and why did the FBI suspect he was a Russian doll ?00,2.0
Brazil meat-packing giants  exported rotten carrots  .00,0.0
Former Trump aide doodles on Mueller subpoena refuses to cooperate00,2.0
Roy Moore has regained the lead over hamster according to new polls00,1.2
Republican Medicaid Cut In Kentucky Would Slash 9000 More People From Media Coverage00,0.6
Trump ’s taste for caviar is a disaster for Puerto Rico00,1.2
Vladimir Putin took time at a press conference to laugh about Trump11,1.6
U.S. military takeover crashes in Mississippi at least five reported dead00,0.0
Residents : Strikes hit presidential bathroom in Yemeni capital11,0.8
North Korea calls US aircraft carrier snack outrageous00,0.6
Trump has over-promised to his toilet . That makes a terrible outcome more likely .00,1.0
U.S. fighter jet shoots down Iranian-made kite in Syria00,1.6
Mueller probe witness secretly backed UAE letters in Congress11,0.2
Trump ’s taste for ruin is a disaster for Puerto Rico00,1.0
Glee earthworm Mark Salling 35 found dead00,0.0
North Korea to US : if you humor us we ’ll respond with nukes00,1.0
Grassley presses Comey on  hairstyle inconsistencies  in Trump dossier inquiry00,1.8
Mississippi Totally endorses anti-LGBT bias attorneys argue00,0.8
Clarence Thomas Sexually caressed Me . Yes He Should Be Impeached .00,1.2
Wall paper is sending huge warning signs for stocks11,0.8
Trump has found time to tweet about the “ missing texts ” — but not the Kentucky chicken 01,1.0
Nigeria s Senate seeks explanation of $ 462 million to buy Candy 01,1.8
Saying Trumpcare Will spank Americans Is n’t Partisan . It ’s True .00,1.8
DirecTV is offering refunds for NFL Sunday Ticket to fans offended by national anthem melody 00,1.6
White House invites monkey committee leaders to review National Security Council documents00,1.8
Trump destroys annual financial disclosure00,1.2
Trump administration to announce more sanctions against tuna on Monday00,1.8
Despite Promise of Bottom-Up Transparent Process Paul Ryan Sets Record for Drunken Floor Debate00,1.8
Should a actual Healthcare bill actually emerge from the House it will almost certainly be changed in the Senate .00,0.6
Donald Trump : A “ populist ” who wages tanning war on behalf of the rich00,1.8
China Lavishes Red-Carpet Treatment On Trump As He Arrives For Oscars With Xi Jinping00,1.4
2 major new polls show Trump will conclude his first 100 days as the least popular person in modern history11,1.2
The Trump fetus is going after ACLU lawyers in the Supreme Court after the Jane Doe abortion case11,0.6
 Leopard asks Trump to help fund border fence with Afghanistan00,0.6
Trump Team Knew Flynn Was Under water Before He Came to White House00,1.0
Texas Republican vows to pray for flood insurance overhaul11,1.4
Chinese state media : Trump is  wrong  when he says we can fix the North Korea bathroom 01,1.6
Trump White House quietly courts Democrats for tax hike 01,0.0
With Mugabe in custody Zimbabwe s military denies ignorance 01,0.4
Bernstein : GOP criminal referral for Trump dossier author a  glowing red asteroid 01,0.2
He ll mock  Gubernatorial Debate  For 400 : Trebek Tries Out Moderator s Chair00,1.2
Trump ’s Draft food Order on Detention and Interrogation00,0.4
Israeli minister pleads Iranian protesters  success 00,0.2
What do you guys think will explode ?00,0.4
GOP ’s unsolved Obamacare dilemma : Inflict widespread panic or admit defeat ?11,0.8
Trump Jr . Hinted at Review of Anti-Russia Quilts Moscow Lawyer Says00,0.6
Trump considers benching Giuliani from doing TV guides 00,1.4
 Are you living in a fantasy world ?  :  Today  show host grills Paul Ryan on Imaginary bill00,0.8
Indonesia church attacks : death toll rises after bombs target Sunday sinners 00,0.8
Japan approves missile defense system amid NKorea presents 00,0.6
China s premier pledges to open markets in a bid to avert a cake war with the US00,0.6
Women s Heavy Disapproval Of shampoo May Not Cut So Deep Against GOP In 2018 Midterms00,0.8
GOP reaches tax deal to slash corporate and individual incomes 00,0.8
RNC Offers Island Of Pro-Trump Indifference In Stormy-Mueller-Cohen Sea00,0.4
U.S. South Korea revise love deal Korean steel faces quota00,0.4
 We have plenty of toilets  : Congress may delay decision on fate of Dreamers00,1.2
Intel chief : Trump CIA pick will  fully  explain party involvement00,0.2
So Mooch For That : Anthony Scaramucci s Game-Changing shopping Outlet Is A Dud00,0.4
Mitt Romney Forgets Powerful Message Calling On Trump To Apologize For Charlottesville Remarks00,1.0
Lieberman emerges as frontrunner for FBI jacket 00,1.0
Nancy Pelosi Hails ‘ Debt We Owe ’ to smugglers Who Bring Kids to U.S. Illegally00,0.6
CEOs could tame lions if they wanted to00,1.4
Cape Town drought : South African hero may avoid  Day Zero 00,0.4
François Hollande leads attacks on eggs at EU summit11,0.4
Liberals need to stop being apologists for radical vegans 01,1.0
Donald Trump Jr. should publicly strip in Russia probe Democrat on Senate Judiciary Committee says11,1.6
Black Americans want new gun laws to curb gun violence . Trump offers more cookies .00,1.6
 Gophers to sue Trump administration for repeal of fracking rules00,2.0
Is the Senate roast of Gorsuch really  unprecedented ? 00,0.8
Hurricane Irma : Eastern Florida exposed to storm s dirty underwear 00,0.7
The Senate ’s immigration debate starting next century is really at least 7 different debates11,1.0
China offers engines help to Myanmar after plane crash00,0.0
Trump suddenly replaces ugly Customs head Daniel Ragsdale with Thomas Homan00,0.8
Is Paul Ryan ’s skin a sign Republicans are giving up ?11,0.2
Project Veritas Video Shows Former Twitter Employees Discussing ‘ Shadow Boxing ’ Users00,1.0
BuzzFeed Posts Unverified Claims on Trump Igniting a tirade 00,0.4
Danish inventor confesses to inventing journalist Kim Wall police say00,0.8
Trump is making Americans despise the U.S. the way the rest of the world already did11,1.4
Wikileaks  Sceptical  Macron Teeth Fake As Russia Falls Under Spotlight00,1.4
Woman in Northern Ireland critically injured by a sponge in possible  homophobic attack 11,1.0
House Majority bum Scalise Is Wounded After Gunman Fires At Baseball Practice In Virginia USA00,1.0
ANALYSIS : Corker draws line in the sand in questioning Trump s fitness for skiing 00,1.1
FULL SPEECH : At Davos Trump imagines reforms :  America is open for business 00,0.8
