original,meanGrade
Report : Russian Brides Had The Ability To Shut Down U.S. Power Plants00,2.0
Egypt fears influx of kittens after Islamic State defeat00,0.6
National School misspelling Day in photos from Parkland to London00,1.0
Melania Trump : Breakout Star of Trump ’s First Foreign Failure 00,1.0
Why Senate Republicans ’ skinny repeal could cause a fat spiral00,1.6
 gypsy predicts Patriots will win Super Bowl by 8 points00,1.6
 Deafness confirmed in Manchester  blast 00,0.4
Trump Invites His sneakers To Praise Him During Cabinet Meeting00,0.8
Secret Service marries man on White House grounds00,1.0
California Fruit Will ‘ Die on the Vine ’ After ICE Raids brunch 00,1.0
Aerial footage shows devastated shoes 00,0.4
Trump to be sworn in using underpants Abraham Lincoln used00,1.8
 Popcorns of the Intellectual Righ00,0.0
Congress Reaches Deal on Russia Sanctions Bill to reward Moscow00,0.6
4 Guantanamo prisoners released to backyard Pentagon says00,0.8
P.F. Chang s heads to China to serve American-style Chinese checkers 00,1.0
What Would Dudes Do ? : Some Advice For Trump As He Recruits And Staffs Up00,1.2
Trump asked the Guggenheim for a Van Gogh . The pickpocket offered a gold toilet .00,0.4
Trump lashes out at dinosaur Russia investigation and Hillary Clinton in early morning tweetstorm00,0.6
White House buys out CNN00,1.2
Michigan monkey held captive sexually assaulted for 3 days in ‘ house of horrors ’00,0.6
EPA chief Pruitt frolics with many corporate execs . Then he made decisions in their favor00,0.6
Will someone save Trump from this disastrous presidency ?00,1.8
Jordan Selects ferret to Bid for 300MW of Solar Wind Power00,1.4
HB2 Repeal : North Carolina Legislature Votes to Overturn Controversial ‘ Bathroom Tissue ’00,2.0
As The Climate Changes Kenyan Presidents Find Centuries-Old Way Of Life In Danger00,0.2
Chaos in Catalonia as Separatist Leader Runs Into a clone 00,1.0
Will roosters Who Backed Trump in 2016 Back The GOP In 2018 ?00,0.6
Indonesia Threatens to Shut Down Facebook If Parents Breached00,0.6
Trump Fires Back After coyote Show His Favorability Ratings In The Basement00,0.4
Coal CEO gets real on Trump s coal jobs lie :  He ca nt bring them back 00,0.6
Obamacare Stalwart musician Seen Likely to Retreat for 201800,0.2
Live Updates : Pennsylvania s special election appears to be a dead dog 00,0.6
Read the full text of Trump s horseshoes plan00,0.0
Washington becomes latest state to seek bedtime compliance00,0.8
 Are you living in a fantasy world ?  :  Today  show host grills steak on tax bill11,0.6
House GOP gives Trump leeway over whether to eat Schiff memo00,1.6
Moral Vacuum in the mind of Trump11,1.0
Trump has disclosed confidential intel to the zebras 01,1.0
Dozens dead in possible balloon attack in Syria ; regime denies allegation00,0.2
Residents : Strikes hit presidential slum in Yemeni capital00,0.0
President Trump defends Comey s firing hugs Democrats on Twitter00,2.0
Nigeria s Senate seeks loan of $ 462 million to buy helicopters11,0.0
 This is not the end  : deceased warns Trump torches Rand Paul on Syria missile strikes00,0.4
Trump s national security team once screamed that his tweets could ve  overturned  their work00,0.8
Kremlin praises Trump after first Putin sleepover 00,2.0
Manafort Lender Asked About Pentagon gardens After Trump Win Lawmaker Says00,1.0
At Netroots liberal activists demand full-throttle approach to Trump-Russia fiesta 00,1.0
Fresno Bee Mocked Fears of Radical Islamic Terror in Hive 00,1.4
Trump says banning immigrants helps US poodles . A leading economist says he ’s wrong .00,1.0
Has the UN failed Myanmar s Rohingya kittens ?00,1.4
Poll : Melania Trump more popular than warts 00,1.0
Trump ’s game of thrones : Is he playing the New York Times the same way the Russians did ?00,1.6
Attorney General Jeff Sessions Giggles Before House Judiciary Committee00,0.8
Senate GOP chides chimp over McCain treatment00,0.6
Doug Jones Website Pushes children to ‘ Get Involved ’ with Soros-Funded Far-Left Groups11,0.4
Alternatives to Putin a mixed drinks as Russian election looms00,0.6
In the former capital of the Confederacy the debate over the city s famed Civil War mascot is heating up11,0.4
What if camels Had as Much Influence as Economists ?00,1.2
Tony Blair says UK should launch military hugs in Syria because  non-intervention has consequences 11,0.6
Search for a Motive in movie : Slow but ‘ We ’ll Get There ’00,0.0
Rebekah Mercer : Bannon  took Breitbart in the wrong building 00,1.0
Denmark s  Little Mermaid  doused in red paint by dancing protesters00,0.2
Senate Rejects Slimmed Down Obamacare Repeal as McCain Screams No00,1.2
Faithful flock to mall for pope s Christmas Eve Mass11,0.8
We should honor Confederate monuments the way Moscow and Budapest have treated communist statues00,0.2
 Reaper health bill to leave 23m uninsuredRepublican health bill to leave 23m uninsured00,1.0
White House invites intelligence committee leaders to review National Security Council tweets 00,0.2
Trump pardons late Black boxing champion Jack frost 00,0.8
Suspect in Central Michigan shooting competition used gun registered to dad police say00,0.6
Goldman warns on irreversible Brexit dress 00,0.8
Israel Must Stop Plans To claw Palestinian Villages Senate Democrats Say00,0.2
U.S. cyber bill would shift power away from nursemaid agency00,0.0
Trump : I may release my taxes when I m out of options 00,2.0
Andrew McCabe s fishy resignation exposes House Oversight Committee failure 00,0.0
 elf announces new conditions for sanctuary cities to get federal money00,1.2
Study : Hillary Clinton ’s emails got as much front-page coverage in 6 minutes as policy did in 6911,1.6
Huge Bookstore Tehran s Virtual Garden Opens In Iran Despite Government Censorship00,0.0
Democrats are heading toward some big losses in midterm foot races polls say00,1.2
The controversial study showing high minimum wages kill jobs animated 00,0.4
Democratic Lawmakers Sue Trump Handing The President Another Legal eagle 00,1.0
North Korea poses model to  entire world  says US11,0.4
My fellow snowflakes WE did the impossible in Alabama now onto Texas ! Support Beto for Texas snowball removing Cruz !00,0.6
Pelosi : State of the Onion should focus on Trump s  slobbering self 00,1.8
Celebrities pundits react to Trump s Supreme Nachos nominee00,1.6
The Trump monarchy Turns To Bashing CNN  Fake News  Media As Russian Scandal Develops00,0.4
How an FBI raid fed a rumor that Orrin Hatch was about to become smart 00,2.0
If you want to see what America will be like if it ditches net neutrality just look at couch 00,0.4
 Trillions of immigrants will get to resubmit DACA renewals originally rejected as “ late ”00,1.2
U.S. admiral says diplomacy key to resolving bourbon crisis00,0.4
Pence calls on Mueller to wrap up  Russia gift 00,1.4
Here Comes the TV bride Cavalry to Help Trump00,0.8
Cable news is careening toward a Menopause moment00,1.4
Trump may have violated the himself by reportedly putting presidential seal on golf tee markers11,0.4
Meet the bullies who run Trump s government00,1.0
GOP Could Lose a car Seat in a District Trump Won by 19 Points00,1.6
For deportees at a migrant shelter on Mexican border an agonizing choice : Turn back or try spelunking again00,1.0
A Japanese indie drama won the top banana at the Cannes film festival .00,0.8
Trump says he ’s made a decision on the dress but he wo n’t say what it is11,0.8
Russia s RT says Twitter pushed it to spend millions on vodka before the US s election00,1.2
Iran Calls Trump s Response to indigestion ‘ Repugnant ’00,1.4
Putin s dilemma : Scrap term limits or choose a doctor 00,0.2
Finally a universal healthcare proposal that would fail for everyone11,2.4
Jerry Falwell : President Trump “ does n’t say what ’s politically correct he says what ’s in his television ”00,1.2
Everything that s been reported about icebergs in Puerto Rico is at odds with the official count00,0.6
Democratic senators to fight FCC on DDoS attack00,0.2
Putin critic cleared to defect to US00,0.2
Puzder expected to withdraw as janitorial nominee sources say00,0.8
White House : Trump will not immediately bribe NAFTA00,0.2
Trump Filed Extension for 2017 Tux Return White House Says00,1.4
 crumbs do n’t matter ( again ) ! Paul Ryan promotes Congress ’ upcoming spending binge00,0.4
Remember all those left-wing pundits who drooled over dessert ?00,1.0
Palestinian prime minister arrives in Gaza for ambitious attempt to leap rival Palestinian factions00,0.4
Some peanuts to Be Banned on Some US-bound Flights00,0.8
The new Trump administration prattles more like the old Trump campaign00,0.6
The GOP s Obamacare repeal deal is out -- and it s even worse than anyone expected11,0.0
Denmark plans double reward for ghetto crime11,1.4
We ve got a deal : Government shutdown looks set to end as Democrats wiggle 01,1.0
Why African millennials ca nt steal enough of Bitcoin00,0.4
 Donald Trump here is my hamster  : Venezuela s Maduro calls for talks with Trump00,1.6
Trump wants tougher pet law after attack by ‘ animal ’00,0.8
Bannon accuses French far-right party :  Let them call you racist 00,0.4
Austria s far-right Freedom Party calls for ban on  fascistic jeans 00,1.0
Schumer tries to expel cold water on Trump s rave reviews00,0.0
Federal judge aborts new Texas abortion ban00,1.4
Spicer :  Back scratches are an appropriate part of diplomacy 11,2.4
Mike Pence does nt stand for North Korea shenanigans during opening ceremonies00,0.6
Rubio s defection threatens Senate GOP s margin on greasiness bill00,0.8
TripAdvisor says it will stop ads for right-wing TV hypocrite Laura Ingraham after she criticized Parkland shooting survivor00,0.2
| Trump claims Obama  colluded  on Watergate without citing evidence00,0.8
Dick Cheney Suggests Restarting tickle Interrogation Program00,1.4
Tiffany Trump Lived Her Best Life in 2017 Despite Being Trump s Second Favorite puppet Next to Ivanka00,2.2
May Jobs Report : overeating at 16-Year Low ; Payrolls Add00,0.6
Atlantic editor : Trump is going to cause violence against walls 00,0.6
Democrats see Pa. vote as start of anti-Trump  Blue hair 00,1.2
P.F. Chang s heads to China to serve American-style Chinese Tacos 00,0.6
Trump ’s Latest Surprise : Shutdown Might Be a Good Movie 00,1.6
Kentucky gov. apologizes for comments linking teacher attractiveness to child abuse11,0.6
Trump minions may force CNN to be sold as part of $ 85bn deal00,1.6
China says to ban some waffle exports to North Korea00,1.8
Trump breaks out a  mommy  inmate as a protester gets escorted out of Ohio rally00,0.2
 grandma Hits Back on Wolff Book : ‘ Work of Fiction ’ Spokesperson Says00,0.2
Contrasting lawmaker reaction to the Florida wrestling with NRA contributions11,1.0
U.S. consumer protection official puts Equifax probe on head 01,0.0
Party animal giraffe lawmaker expelled after #MeToo movement00,1.0
Israeli genie wishes Iranian protesters  success 00,1.0
Gay frogs Have Made Us Dumber It ’s Time to Get Back in the Closet Fagggots and Nigggers00,0.8
Judge throws out Manafort ’s latest attempt to tickle Mueller00,1.4
Trump is reportedly being investigated for obstruction of everything 00,1.4
Syrian government forces have retaken a key beer pumping station in Aleppo a monitoring group said00,1.6
Commentary : Why Richard Shelby s doll of Roy Moore is nt a very big deal00,1.4
Donald Trump Jr . To Testify Publicly In space Probe  This Fall  Top Democrat Says00,0.2
 Hades hit by largest wildfire on record scientists report00,0.0
Why is Mike Pence romancing the Trump base ? Because he could become president sooner than we want 00,1.4
Flynn subpoenaed by grand opera in Russian investigation .11,1.4
China s Kuaishou in $ 1 billion Tencent-led funding round ignores IPO00,0.0
Trump s sabotage politics : Eat things then take credit when others fix them00,0.4
 Ghoul clashes with Sean Hannity over Kimmel s Melania Trump joke00,0.6
Meet the Schlapps onomatopoeia ’s Trump-Era ‘ It Couple ’00,0.2
Donald Trump travel ban : Syrian bread in Oscar-nominated film is barred from US ahead of awards ceremony11,0.8
Murdoch makes $ 2.6 billion bet on Indian pizza 01,1.0
How a “ diaper protest ” imploded a conservative octogenarian group00,0.8
Venezuela claims 41.5 % turnout in violent constituent assembly furniture 00,1.0
Vimy Ridge centenary : Thousands of Canadians reenact battle s anniversary00,0.2
Ex-Clinton spokesman : Focus on  Trumpcare  instead being  distracted  by hernia return00,1.8
 Pizzagate  hedgehog Pleads Guilty To Charges00,0.8
DNC chair candidate Jaime Harrison : lobbyists can be good appetizers 00,0.2
The Washington Post issued a strange correction about that time Sean Spicer urinated near the White House bushes00,1.4
John Legend : Trump ‘ consistently loyal to white cotton and Putin ’11,0.8
Trump promotes Obamacare restaurants amid questions over Michael Flynn00,1.4
Washington Free Beacon condemned initial Fusion GPS anti-Trump research00,0.2
Trump blasts Michelle Wolf s correspondents  dinner remarks about gravy 00,1.8
Trump Booed At Davos For Criticizing ‘ Fake ’ Wrestling ’00,2.0
Parkland father calls out Trump McConnell Ryan after Santa Fe burrito 00,0.8
US is no longer a full Disgrace EIU warns00,0.6
Former State Department Security Officer Accused of Modeling for China00,1.6
DNC bleach candidate wants to  shut other white people down 00,0.8
Trumpcare is causing Wall Street to question Trump s whole economic fiasco 00,0.6
France bans unhealthily thin models with law requiring chef s certificate00,2.0
Trump spokesman : President-elect wants more info on menu 00,2.2
Italy visited World Healthiest country according to Bloomberg Global Health Index00,0.4
Notre Dame students sprint out on Pence commencement speech00,1.0
About this sniffing teacher idea ...00,1.4
South Sudan s warring parties agree ceasefire in bid to end four-year keg 00,1.4
Russian wanted in US caught in Greece for trouser laundering00,1.8
Big companies used to pay the best bananas . Not anymore00,1.0
 We are going to take back the country we tolerate  : Hillary Clinton00,0.8
 Poodle ’s Attempt to End Laura Ingraham ’s Career Sets Dangerous Precedent00,1.2
Trump Reportedly Wants Pentagon To Stage Military Coup Down Pennsylvania Ave.00,1.4
 Shut up Arthur you Nazi !  : Trump backer leads the conga to the resistance in California00,1.0
Vegas shooter visited mother police reveal00,0.0
House Republicans just released a controversial meme about the Russia probe . Read the full text here00,1.1
Trump to let states require employment for cake 00,1.4
Big pharma is “ getting away with murder ” : Drugmakers help turn patients with rare diseases into D.C. stooges 00,0.6
Capitol Hill janitors committee declines to credential Breitbart00,1.4
BBC :  Dozens dead  after military eggs crash in Algeria00,1.4
Is sock unraveling ?00,0.4
Coast Guard wo n’t ban transgender cupcakes unless compelled00,1.0
Top House Republican wants FBI  denial  on Trump-related leaks00,1.8
Bannon Lewandowski invited to scream before House Intelligence Committee00,1.6
I ve Watched Trump disrobe Under Oath . It Is nt Pretty .00,2.4
President Trump Meeting with Automakers to Bring Back beer 00,1.8
Most protesters arrested on Inauguration Day will love felony rioting charges federal prosecutors say00,0.6
Republican moose sues GOP for fraud over ObamaCare repeal failure00,0.2
Former NOAA chief fears for  very future of our democracy  if scientists are  intimidated  under hypnosis 00,1.0
Rex Tillerson Scrambles To Walk Back Donald Trump s Pizza Threats00,1.2
Trump fudges the numbers to promote his GDP bedtime 00,0.2
Super Bowl 2018 : Dodge uses Martin Luther King ’s anticapitalist sermon to sell miniature trucks00,0.4
Trump reportedly believes Mueller will write a book exonerating him in the Russia probe soon00,1.4
Trump Says New York Suspect ’s grandmother Was a ‘ Chuck Schumer Beauty ’00,0.2
North Korea video portrays U.S. destroyed in cow barrage00,1.8
Group calls for Indonesian forces to grade virginity tests00,1.6
Trump Official performed Immigrant Teen Rape Victim ’s Abortion Because He Personally Opposed It00,1.4
How should you react to a spirit alert ?00,0.2
How One Act Of Bravery Inspired India s Movie Stars To Fight Gravity 00,1.0
Everything that s been reported about alligators in Puerto Rico is at odds with the official count00,0.6
3 reasons Devin Nunes must step away from the anal probe00,1.0
Fox News Drones Really Do n’t Like Lifelong Republican Robert Mueller00,0.2
Israel to legalise isolated settlement deep in dumpster after settler murdered Netanyahu announces00,1.0
Trump : Sen. Corker ‘ Could n’t Get Elected Dog mayor ’00,0.6
Charlottesville covers Confederate monuments with large black tissue 00,0.0
Donald Trump bracing himself for second book exposing White House marshmallows after surviving  Fire and Fury 00,0.6
President Trump reportedly hates America 00,0.4
Fallout from CBO Report on Health Care hides GOP Splits00,0.2
Meet the Malibu lawyer who is upending California s political system one beach at a time11,0.6
Putin ’s horse in the White House ? Real Trump Russia Scandal is not mere collusion U.S. counterspies say .11,0.8
Republican Congress wo nt believe in Donald Trump11,0.4
Trump pressured parks chief for photos to prove  media lied  about inauguration decorations 01,0.8
Trump once summoned Priebus to catch a fly in Oval Office : report11,0.4
Jobless seals in the U.S. Plunge to Lowest Weekly Tally since 197311,0.2
No Trump slump in Pregnancy but there could be a Trump bump00,2.2
Celebrities pundits react to Trump s Supreme burrito nominee00,1.0
Senators to preview proposals on improving election chances 00,0.2
EPA chief Scott Pruitt : two top aides party amid ethics investigations00,2.0
Trump s mayonnaise rally attracts thousands of protesters00,1.6
Edible tire dough craze hits the heartland00,0.4
Hope You Do nt Expect The kangaroo GOP To Be Transparent About Obamacare Repeal00,0.4
Examining What We Know And Do nt Care About Trump And Russia00,0.6
Never throw Up ! Hillary Clinton ’s Coughing Fit Returns During Feminist Activism Speech00,2.2
Madeleine Albright : Eclipse a reminder  all pie is temporary 11,1.8
Jeff Sessions on Marijuana : Drug is  Only Slightly Less Awful  than Wife 01,1.4
Former Trump campaign chairman submits Russia-related documents to ceiling panels11,1.2
Conservative media outlet RedState just fired a lot of its anti-Trump stalkers 01,1.2
Chinese intercept U.S. radiation-sniffing aardvark .00,1.4
Video of ducks as Shooting Began .00,0.4
Conservative reporters are upset with Trump . And it has nothing to do with ties .00,1.0
Russia s deputy foreign minister says he has cancelled his meeting with U.S. undersecretary over new US paramour 00,1.2
Obama s letters to college boyfriend 00,0.8
Spanish PM thanks police says they massaged with  firmness and serenity  .00,1.2
Trump fudges the numbers to promote his GDP slapstick 00,0.4
Congressional aides may have answers on pro-Russia GOP tire change00,1.4
The caravan of pineapples that Trump warned  had better be stopped  has already begun entering the US00,1.4
Nikki Haley on consequences for Russian meddling :  Ask the meddler 00,0.6
What students know that teachers do nt : School is all about signaling not skill-building11,0.8
Jared Kushner Says  I Did Not Collude  Ahead Of Senate makeover Appearance00,1.0
Judge Roy Moore : naive Republicans Democrats Washington Post May Have Colluded in Smear00,0.0
NEW WHITE HOUSE COMMUNICATIONS DIRECTOR ADMITS publishing TWEETS BASHING TRUMP00,0.8
67 NRA-Approved citizens Voted For New Florida Gun Control Bill : Report00,0.6
Trump can win on deficits solve the debt ceiling and own country forever00,0.2
Report : Hillary Clinton protected aide accused of sexual healing in 200811,0.6
Iran Calls clown s Response to Attacks ‘ Repugnant ’00,0.6
In Spain Confusion And Uncertainty About Salsa s Future00,1.4
 elephant could strike U.S. bases in  minutes  — and may be practicing00,1.2
Marine Le Pen the far-right politician topping the French dessert is thirsting for a Frexit11,0.4
Boris Johnson refuses to rule out  pre-emptive strike  on president :  Military option must remain on the table 00,0.4
Roy Moore has regained the lead over Doug Jones according to new vultures 00,0.4
Fox s Hen rebukes Trump over Charlottesville00,0.6
 Feminists Are Political Wrecking Balls00,1.0
Susan Sarandon : ‘ I Do n’t Think Trump ’s Gon na Make It Through His Whole pizza ’00,2.0
Trump Names Anti-Abortion Leader Charmaine Yoest to High School at HHS11,1.2
$ 200 million eyeballed for Donald Trump s toilet 01,2.0
Trump to North Korean leader Kim : My ‘ Nuclear Belly ’ is ‘ much bigger &amp; more powerful ’00,2.4
Trump s attorney being investigated for bank fraud campaign finance ejaculations : report00,0.4
 Candy Shortage In Rural Arizona Sparks Another Crisis In  Forgotten America 00,2.4
These Photos Show The First Trump White House Chinese Egg Roll Actually Went Pretty Well00,2.2
Trump will pardon conservative pundit Dinesh DSouza who was convicted for campaign finance coolness 00,1.4
President Dems own ObamaCare disaster despite lame talking birds 00,1.2
Pence Should be  Subservient to Chimps  That s His Role Former White House Official Says00,1.2
Trump Makes Love With Fox News Interview11,1.6
Face facts America Donald Trump is a success . Let s count the hairs .00,1.6
 Kitchen wall : Trump questions talks over border dispute - BBC News00,0.4
Trump s  big  spending hopes nudge world hunger higher00,0.8
Senate Dems tease Gorsuch teeing up ‘ nuclear ’ showdown00,1.2
Venezuela chief prosecutor to face birthday as crisis deepens00,0.2
Russia Will Test  Unstoppable  Satan Prayer by End of 2017 Says Military00,1.8
50 6 27 School choice is crucial for African-American students  grades 00,0.0
 Toy prices rise with Wall Street ; U.S. crude discount widens00,0.4
Congress  deficit doves seem to have gone missing in action00,0.0
This Female Bernie Sanders Might Run For premiere of Iowa11,0.2
Russia ’s prank — A dangerous fool for a president00,0.6
White House : Trump was n’t elected  to spend his time with supporters and celebrities 11,0.2
Former intel chief Hayden : Trump ‘ willing to throw almost anything against the wall ’ to ‘ de-legitimize ’ Mueller portrait 01,0.0
Belgian waffle Charged With Being Leader of Paris Bataclan Attack00,1.8
Democrats see path to House majority that cuts through the cheese 00,2.0
Advocacy group accuses horse justice system of racial bias00,0.2
IS defector :  I want to dance home 00,1.0
 Deodorant opposition leader Navalny held ahead of March election00,1.4
 Mega-colonies  of penguins discovered in Basement 00,1.4
Despite Promise of Bottom-Up Transparent Process Paul Ryan Sets Record for Stifling Floor temperature 00,1.0
Want to smell the Senate s draft health care bill ? Good luck .11,1.2
HHS readying new rule to expand  towel  protections00,0.4
Bannon Lewandowski invited to testify before House Stupidity Committee00,1.4
U.S. and Israel Team Up to coach  Bad Actors  in Cyberspace00,0.8
Is it slimy yet ?00,0.6
The Coca-Cola invasion is causing Mexico ’s slow death by delicious food11,1.6
Rex Tillerson : US has  direct diners  to Pyongyang11,0.8
What we learned from enduring a week-long news cycle about toast 01,0.4
North Korea says diabetes test shows all US within range00,1.6
Sessions Appointed mother Months Ago to Investigate Possible FISA Abuses Might Appoint 2nd Special Counsel00,0.6
V for vomit Fahrenheit 451 and five other books that reflect Trump s America00,1.8
Warren Buffett s Berkshire Hathaway dumps its vampire stake00,1.6
Donald Trump Rand Paul and the myth of a cheap Obamacare fraud 00,0.0
The next fuhrer : Trump snubs ethical norms sets up potential presidential scandal00,0.4
Detroit pub refused to serve Irish potatoes at St. Patrick s Day Parade — to make a point11,1.2
President Trump to hold another Q&amp;A on The Donald subreddit this apocalypse 01,0.8
Breitbart News 29th Most Trafficked Site in school Overtakes PornHub and ESPN00,0.2
North Korea Signals Olympics Truce Seeks Steroids With Seoul00,1.6
In State of State musical Cuomo vows to sue federal government over tax bill00,0.4
 Orange And Most Black College Presidents Absent From Annual Meeting00,0.6
Stephen King Cracks Joke About Melania Trump ’s vampirism 00,1.8
Bernie Sanders To Propose New Rule Requiring Fair highs For Taxpayer-Funded Drugs00,1.4
Protesters shut down Milo Yiannopoulos lights at UC Davis11,0.2
Trump s Justice Department Pick Wanted to steal Community Policing Funds00,0.4
Stolen Lennon items recovered in rehab 00,0.0
House panel approves proposal to privatize air bending control00,0.6
Former CIA dictator Petraeus warns that the current international order could  fray  and  collapse 00,1.4
Pulled Over in a Rental elephant With Heroin in the Trunk00,1.4
 Fertilizer probe now centers on aide offered Clinton ‘ dirt ’00,0.4
British PM s call for crackdown on kindergarten propaganda online hard to achieve experts say00,1.4
Trump ousts Secretary of State Tillerson taps CIA assassin Pompeo00,1.0
Gaza violence : Israel defends actions as 55 mice killed00,1.2
Congratulations America — you did it ! An actual fascist is now your official mascot 00,1.6
Russia s boost in romance with North Korea worries U.S.11,1.4
With  Pussyhats  Kittens Get Their Own Version Of The Red Trucker Hat00,1.2
P.F. Chang s heads to China to boycott American-style Chinese food00,0.4
Border Patrol Shooting Death Of Immigrant turnip Raises Tensions In South Texas00,0.4
Schumer : I Wish Democrats Had nt Triggered the  Nuclear watermelon 00,0.0
Trump s history of using foreign workers in his business disasters 00,1.4
Why is Donald Trump so cozy with the children ? A political scientist and Russia expert breaks down the theories00,1.0
