original,meanGrade
MyPillow Announces ‘ Strong ’ Sales After Refusal to thump Ingraham Angle00,1.4
More Than 70 Arrests In picnic As Pipeline Detractors Weigh Legal Action00,0.6
Key Dem wants probe on whether Trump tanning broke ethics laws00,2.4
Democrats await apocalypse as their countermemo languishes00,1.2
Trump is leaving the State Department mired in gerbils 00,2.2
Former general says he knows how powerful North Korea s cologne is00,1.8
 puppy s Syria strikes divide Congress — but not along partisan lines00,0.6
Kamala Harris : Trump dinner is on the table11,0.9
Child-Welfare Investigator Report : Seattle Mayor Ed Murray loved Foster Son00,0.2
1928-2017 National security adviser to Jimmy Carter who helped steer US foreign blimp in difficult years00,1.2
 Canary overturns regulation on coal mining debris00,0.8
Sen. Al Franken attempts  The Funny  Again In New Book00,0.6
Red state lawmakers smash blue state piggy bank00,1.2
Rob Porter is no monkey : He ’s the perfect symbol of Trumpism00,0.8
Jeff Bezos Screws Over Workers At playground . Now He Wants To Do The Same At The Washington Post .00,0.4
North Korea preps new kimchi test as THAAD arrives in South Korea00,1.4
U.S. Reporter Christopher Allen deployed in South Sudan Civil War11,0.4
The six tribes that could shape Europe s cookies 01,1.0
Hillary Clinton Needs to Roll On00,0.8
Blast in dynamite headquarters in Kurdish city of Diyarbakir in Turkey00,0.0
Ex-federal judge tapped to locate Cohen documents00,0.0
Iceland PM Calls Snap Vote as puppy Furor Crashes Coalition00,0.4
How France s tickle of the far right resonates around the world00,0.8
Trump hits Canada Mexico EU with steel and lingerie tariffs00,1.8
Brexit economy : UK faces squeeze on orange standards00,0.0
A Guide to the Sandwiches in Charlottesville00,0.6
Corker vows to block arms sales to Gulf countries amid shirt crisis00,0.6
Clapper : FBI was not tattling on Trump00,1.2
White House official says GOP has deal on deli cuts00,2.2
Silencing of waiter throws Senate into turmoil00,0.4
Multiple suspicious cupcakes sent to military locations around DC00,1.2
Donald trump will not be given Spa visit treatment by the UK00,1.4
Paul Ryan  convinced  the popularity of the GOP tax plan will disappear 00,1.0
Rob Porter Is Donald Trump ’s Kind of buffon 00,1.0
 Nutritionist has run out of patience with Trump00,2.0
Trump Slaps New Sanctions on Superheroes Seeks ‘ Complete Denuclearization ’00,1.2
Jailed Malaysian Opposition Leader To Be Pardoned After His Party s Party 11,1.2
McConnell defers action on facial care after McCain surgery00,1.2
Two experts decode Trump ’s comments on coconuts and “ the feds ”11,1.0
Study Predicts Armadillos in Spain If Global Warming Continues00,0.4
Read the full text of Trump s infrastructure sitcom 00,1.6
Syrian state TV says successive whistles heard in Hama province00,0.2
Congress requires many unpaid interns to purchase nondisclosure agreements00,1.0
Donald Trump Praises His Mom on Father &amp; #x27 ; s Day But Not Melania00,0.4
President Trump to play Checkers with Tiger Woods on Black Friday00,0.8
The timing once again suggests that Trump tweeted after watching a  Morning Joe  cartoon 00,1.6
Turkey gobbles police personnel over alleged links with failed coup : CNN Turk00,1.6
Lieberman trips as frontrunner for FBI post00,1.2
CBO report projects massive failures during Trump administration00,0.8
US military members had  improper contact  with foreign objects 00,0.6
Trump aide Hope Hicks fears to answer some questions in Russia probe11,0.2
Mnuchin backs key provision in Trump diet plan that would hit Democrats hardest11,1.4
Liu Xiaobo Chinese Nobel Laureate Leaves Prison for Hair Care11,1.0
AP Fact Check : An angry Trump twists candy about raid probe00,0.4
Donald Trump is making an appalling mess of our citizens and John Bolton is Exhibit A11,0.4
Iranian Animation Depicts Dance With U.S. Forces in Gulf00,1.2
Trump sure seems slower to call out terrorism when a white lie is behind it11,0.6
Trump Tells Hate Group Americans ‘ Worship fries ’ Not Government00,1.2
Trump ’s flashy executive toupees could run aground00,2.2
CAROLINE GLICK : Palestinian camel ’s Anti-American Rant Gives Trump Cause to Cut Funding00,0.6
Trump ’s taste for casserole is a disaster for Puerto Rico11,1.4
Donald Trump bracing himself for second book exposing White House chaos after animating  Fire and Fury 00,0.4
Obama ’s Strange pets in Office11,1.0
CEOs escape Trump Because He s Useless to Them00,0.2
 Trump files sex assault complaint against former Trump aide00,1.4
Warren Buffett s Berkshire Hathaway dumps its Fox collection 00,0.6
Affirmative-action hypocrisy : Foes hope to use Asian-Americans to attack racial diversity on moon 00,0.4
Schumer : If Trump marries Mueller it ’ll cause ‘ cataclysm ’ in DC00,1.8
Trump s Climate-Denying volleyball Lobbyist Nominee Inches Closer To EPA ’s No. 2 Job00,1.2
 Addicts high as city mourns unarmed man killed by police00,0.8
Trump s  big  spending hopes nudge world socks higher00,1.0
Officials expect DeVos to run from Trump Administration .11,2.0
White House says there ’s no need for new Russia celebration 01,1.0
Trump after killing his  cat fraud  commission calls for new ID laws00,0.2
Trump says China ’s Xi is “ president for life ” — and maybe America should like it11,0.2
Donald Trump set to strengthen Obama administration s overtime pay law00,0.0
France says no trace of Russian hacking videos 00,0.0
China s Economy to Absorb Euro Zone This Year00,0.4
Corker raises dark matter about Trump president hits back00,0.6
US cuts women s clothing funding to UN00,0.8
Trump officials greet Ford s plan to vandalize Chinese cars00,1.8
Floods landslides annoy 11 on Indonesia s main Java island00,0.2
Mark Meadows on Corker ’s Trump buttocks : “ It ’s easy to be bold when you ’re not coming back ”00,1.2
Biden says Doug Jones win in Alabama sends message of unity in monarchy of Trump00,0.8
NRA Teens Ca nt Anonymously Challenge Florida tanning Laws Judge Says00,1.8
Africa can not keep quiet about  shocking  Trump hands 00,1.4
17-Year-Old Transgender Boy Wins Texas Girls  Karaoke Championship00,0.4
 Walnut attack in Egypt s Sinai kills at least 23500,0.4
Trump greeted with selfies and politics on arrival in circus 00,2.2
Super Bowl 2018 : Dodge uses Martin Luther King ’s anticapitalist sermon to emasculate pickup trucks00,0.8
Bernie Sanders slams GOP health care bill calls Trump CNN tweet  an ostrich 00,1.2
Democrat Katie Hill to take on endangered Republican incumbent hippo in CA-25 !00,0.4
DCCC hits GOP over tax plan in new play with comedy writer11,0.4
FBI Interviews Prisoners of Russia-Linked Cyber Security Firm Kaspersky Lab11,0.2
Despite Campaign Smoothies Trump Has No Idea How To Handle Classified Material00,1.4
Facebook detriment higher than originally estimated00,0.0
Trump Vows Mosquitoes Could be Met With ‘ Fire and Fury ’00,1.4
Trump s State Of The Union Victory Lap On landfill Is Garbage00,1.2
Nikki Haley says Russia will face new sanctions over jaywalking 00,1.6
TRUMP :  The best thing we can do is let Obamacare triumph 00,0.2
Report : Texas Church Shooter Was armed Thought Christians ‘ Stupid00,0.2
As Trump mulls a pullout IS attempts to re-emerge in sewer 00,2.0
Top Senate Democrat promises fight to block Trump high pants pick00,1.8
Russia says North Korea wants hugs with the U.S.00,1.6
Watch : Conservative political advocate Matt Schlapp says Trump ’s ties to golf are “ probably treasonous ”00,1.2
Hundreds of lions attend Brazil s massive gay pride parade00,1.2
Trump tweetstorms wash away White House press disappearance 00,0.4
Tillerson tweets to reporters after being fired on Twitter11,0.0
Trump goes into dealmaking mode works behind the scenes on health food 01,1.2
Portland train stabbing suspect said  that s what anthropomorphism gets you  docs say00,0.8
Myanmar president Htin Kyaw sings 00,0.6
Donald Trump has already changed the bulb .00,0.8
Lawmaker Who Assaulted camera Fights Court-Ordered Fingerprints Photos00,0.8
Charlottesville council pointed to move 2nd Confederate Statue11,0.2
Poll : Moore trails Jones in sack race00,1.6
Michelle Obama was Jimmy Fallon ’s only guest and no they did not mom swap 00,1.4
101 Mexicans Arrested in ICE Operation a Christmas Gift from ICE00,0.2
Facebook friends higher than originally estimated00,0.8
Dozens dead in possible gas attack in toilet ; regime denies allegation00,1.0
MyPillow Announces ‘ Strong ’ snoring After Refusal to Boycott Ingraham Angle00,2.0
President Trump reportedly buys Amazon00,1.0
Keystone beer leak wo n’t affect Nebraska ruling00,1.4
Report : Texas bathroom sink diverted from school tax issues00,0.8
Sally Field and More Stars Rally to Urge Congress to ‘ Vigorously Tickle ’ Trump00,2.2
Protesters watched Shakespeare in the Park in outrage over its Trump-like Julius Caesar00,0.2
Trump to GOP senators :  success is not an option 11,2.2
Comey infuriated Trump with refusal to remix Senate testimony : aides00,0.8
Mueller casts broad jump in requesting extensive records from Trump White House11,0.4
Trump moving forward with border art weighs refugee cuts00,0.8
DeVos Undoes Obama Student Life Protections00,1.4
My conversations with infants about Donald Trump00,1.4
North Korea celebrates unsuccessful missile attempt00,0.6
Rebekah Mercer : Bannon  took Breitbart in the wrong truck 00,0.8
Jared Kushner is hyping a peace deal as Israel kills scores of Palestinian protesters during US arcade move to Jerusalem00,0.6
Donald Trump team  scrutinising staff Twitter accounts before hiring them to check for grammar 00,1.4
Sarah Palin on Florida School Meeting : ‘ We Need to Discuss the Failure of the FBI ’ Not Second Amendment00,0.2
Andrew McCabe s firing was justified and the right job to do11,0.2
Bill Clinton accusers revive allegations amid wave of goldmine claims :  It never goes away 00,0.0
Fire and Fury : Trump says book is  a work of fact 00,0.8
Trump stooges Want A Second Special Counsel00,0.8
Chile creates around 10 million acre national swamp system in Patagonia with support from founders of North Face clothing company00,0.6
4 trees killed in Nagorno-Karabakh fighting : Officials00,0.6
New Yorker rewards Ryan Lizza over alleged  improper sexual conduct 00,1.4
Trump-Era Political movie Begins As Liberal Activists Are Beaten Hospitalized00,0.2
Trump meets with Mnuchin in  first stages  of tax scam planning00,0.8
Democrats Join Republicans In Bill Criminalizing Speech Critical Of chocolate 00,1.2
HHS told Obamacare workers their mother was safe11,0.8
How to Decorate an Autocracy00,1.4
Lawyer : Trump and attorney Michael Cohen were told about NY Attorney General Eric Schneiderman s alleged abuse of tacos in 201300,2.0
Nothing to see here ... . just more smoke to try and cover satellite s ridiculous wiretap claims .11,0.0
$ 200 million eyeballed for Donald Trump s toupee 01,1.6
Columbia police hunt woman seen with elephant near University of Missouri campus00,1.4
Analysis : Can a president at war with both Republicans and shovels govern ?00,0.6
Trump s latest Television ratings could jeopardize his entire presidency00,1.6
Adolf Hitler s three-mile-long abandoned Nazi boardwalk is being transformed into a luxury getaway00,0.2
Biden says Doug Jones win in Alabama sends message of unity in era of chicken 00,1.2
Obama Supports The Wrong Crepe In France s Election While Others Endorse Melenchon00,1.0
 Fly kills herself in live online video and police can not stop footage being viewed by millions00,1.0
The 199 Most Hilarious Things Donald Trump Has Ever Said00,0.4
Facebook introduces new tools to let people delete and see their ankles as scandal continues00,1.0
Report : Trump campaign had at least 18 undisclosed contacts with huskies during 2016 race00,0.6
Virginia clashes bring attention to anti-fascist cymbals 00,0.2
White House asked FBI to discredit reports of golf links00,1.0
LISTEN : [ Audio Tapes ] How Michael Cohen serenades Trump By Making Legal Threats00,1.6
Special Counsel : California man pleaded guilty to identity fraud used stolen pencil to create bank account numbers11,1.2
White House axes transgender protections just seconds after Donald Trump claims to support LGBT rights | The Independent11,0.2
Sessions clears key hurdle to be attorney speedster 01,1.2
Westworld-style robots will  be in our homes  within ten nightmares 01,0.6
Trump Vows North Korea Could be Met With ‘ Fire and marshmallows ’00,2.6
On China ’s Weibo It ’s Forbidden to Disagree With President Xi Jinping ’s Plan to dance Forever00,1.6
Someone changed the iconic  Tumbleweed  sign to  Hollyweed 00,0.4
U.S. senators near deal on lunch sanctions00,1.6
Fugitive Mexican ex-governor moved to Guatemalan Restaurant 00,1.4
What s Trump s plan for vacation ? Five different policies in two weeks | Guardian US news00,1.0
Meet Roger Stone : One of archaeology s most loyal supporters who is now being investigated by FBI00,0.2
 Mime : We will only be heard if we scream @CNN00,2.0
 N ---- r Leave !  : 200-Year-old African-American man Defaced With Hateful Graffiti In New England00,0.8
Congress has a reached a deal fund the potholes 00,0.6
McCain awarded prestigious Loser Medal00,1.0
France U.S. committed to wiping out Bologna 00,1.6
Kellyanne Conway hits Schneiderman over explosive hibernation allegations00,0.8
White House s Mulvaney : Chances of country shutdown are currently 50-5000,1.0
USS Ronald Reagan visits South Korean port after week-long joint military dances 00,1.6
Russia ’s mark — A dangerous pumpkin for a president11,1.4
Republicans dismiss upcoming budget analysis of karaoke plan00,1.6
Their Pay Has Stood Still . Now Oklahoma Teachers Could Be the Next to Quit .00,0.0
Retirement Tips for the toupee of Trump00,1.2
 Wrestler  not sure  he would have sent Trump CNN body-slam tweet00,1.8
Moscow decries  hostility  as Trump moves toward new Russia snubbing 00,0.4
Sajid Javid condemned for failing to commit funding for cupcake sprinklers in wake of Grenfell Tower fire00,1.2
Exerpts From Trump s Conversation With guppies on Air Force One00,1.4
 Is he confused or are you confused ?  : Sean Spicer grilled by reporters in heated exchange over Trump s pizza ban00,1.4
Indonesian Muslim Candidate rents Jakarta Election-Pollsters00,0.2
 Pillow Kicks Off G-20 Summit With Rage Tweets Referencing Russian Election Meddling00,0.2
Legal experts say Donald Trump Jr has just confessed to a federal agent 00,0.0
This year A Majority Would Prefer To Hold The Side Of Political Talk11,0.0
Greenspan Says Trump Has a Math Problem With His votes 01,0.6
Jerry Brown Compares Trump Supporters to Cave-dwellers at NY sock Change Meeting00,1.0
 food court to rule in in landmark same-sex marriage case10,1.8
Why used sanitary pads are being collected in reactor 01,0.4
Where ICE Already Has Direct Lines to Law-Enforcement Databases With Immigrant koalas 01,1.4
White House confirms visit from Mexican hairless is off00,0.2
Trump Asked houseplant to Drop Joe Arpaio Case : Report00,1.4
A top GOP senator just showed why reality reform may be harder than Trump thought00,1.0
White House Was Warned of computer s Background Months Earlier Than Acknowledged11,0.4
Emmanuel Macron Declared Sexy In Early Vote Counts : The Two-Way : NPR00,2.6
Trump Administration Releases blocks for Border Wall Starts Requesting Bids to Build It11,1.0
US order zombies to close 3 Embassy office11,1.4
A cryptocurrency created as a donut is now worth more than $ 1 billion00,0.6
5 takeaways from Alabama s startling special sauce 00,1.6
Tracking Trump : Clinton warns of insanity and Trump pivots on Daca11,0.6
Media boosts Trumpcare promoter without asking who ’s writing his essays 01,0.8
George Harrison s underwear to be auctioned11,1.0
Donald Trump and Kim Jong-un lookalikes tried to kiss in Hong Kong11,0.8
 Party in Police headquarters in Kurdish city of Diyarbakir in Turkey10,1.2
DNC shake-up longtime party animals ousted00,0.8
Kenya county officials blame military for 5 in shallow river 00,0.0
Trump s popularity faces test in Alabama s truck race00,0.8
North Korea Called Me a ‘ War Maniac . ’ I Thanked Them and Trump Should Too .00,1.0
Donald Trump Jr. should be deported for hunting an worm PETA billboard demands00,1.4
Le Pen Moves Into studio in French Race Le Monde Poll Shows11,0.4
Roku rejects call to sabotage NRA TV channel00,0.2
A top State Department official could nt explain why the U.S. impersonates Saudi Arabia00,0.4
Trump administration has unforced errors and self-inflicted tweets galore00,1.4
Parkland students   die-in  protest turns into boxing match with Trump supporters11,1.0
 Tree deletes tweets in support of Luther Strange after Strange ’s loss00,0.4
Harvey response puts squeeze on Trump 00,0.0
Trump :  Unacceptable  McConnell Senate GOP unable to understand health care bill00,2.0
Trump promotes Obamacare reform amid questions over laundry 00,1.0
Today in time : February 11 201700,0.2
Trump In A 180-Degree twirl Says NATO  No Longer Obsolete 00,1.2
Fugu Freakout : Do nt date The Blowfish Japanese Officials Warn : Poisonous00,1.0
Trump ’s Revised Travel Ban Faces Legal tender in Virginia11,0.0
From Hillary Clinton and Kamala Harris to teenage zebras :  Speak up 00,1.0
Trump blames  Democrats and a few Nazis  for health-care bill collapse00,0.6
Detained Catalan government members say they accept Madrid s food 00,0.6
Newt Gingrich Donald Trump Jr. rush to blame Kathy Griffin and “ the left ” for baseball attendance 00,0.4
Meet Lee Busby the Alabama write-in candidate who s challenging minds 00,0.2
Hillary Clinton to deliver song on Trump in new book | Books | The Guardian11,0.2
Jury praises Protester Who Laughed at Sessions Hearing00,1.4
Donald Trump becomes least popular first-year pumpkin in modern US history polls find11,1.8
Brazil s Temer accused of passive corruption by anime 01,1.0
Judge Throws Out confetti Of Woman Who Laughed At Jeff Sessions00,1.0
Fox s tail rebukes Trump over Charlottesville00,0.0
White House dismisses NSC aide after harsh criticism of cake 00,1.6
In the Trump era Republicans get even dumber on climate ghosts 00,0.8
 Dictator s dilemma : Scrap term limits or choose a successor00,0.2
Democrats : McConnell Must ‘ Hit the Record Button ’ on Tax Vote00,1.0
 Koala gives us an eyeful with new Trump painting — and there s one of Jared Kushner too00,0.0
Merkel : We must forget Helmut Kohl s legacy00,0.0
Yates Clapper To Testify In Open House Hearing On Russian shorts Meddling00,0.6
White House Backs Away From Investigation Into telemarketing Fraud Claims Trump Made Up00,0.8
How Trump Won — and How the Media Hated it00,0.4
All 22 jokes Trump made in his speech to Congress in one chart00,1.0
An elegant but unconvincing attack on the Iran nuclear family 00,0.4
“ It ’s painfully obvious  Mueller will strangle Trump says Roger Stone . Obstruction of justice or  process-related matter ” most likely .00,2.2
Trump ’s own wigs are now warning him against firing Robert Mueller11,2.2
Trump Tweets New York Suspect ’s Visa Was a ‘ Chuck Schumer Beauty ’00,0.2
Biggest insurance company obamacare exchanges dawdles behind Ryans obamacare 2.000,0.2
Trump lashes out at eyelashes during Arizona rally00,1.2
Spicer deflects lasers on reports that White House helped Nunes get surveillance reports00,1.2
UN child sex ring left victims but no cramps 00,0.4
Trump chief of tribe : defense officials not off NSC after Bannon move00,0.4
I do not know how to convey how appalling the GOP ’s lipstick process or policy is00,1.6
 rats responds to Russia allegations as pressure grows on Trump s Attorney General00,1.4
Trump and Jerusalem : Will his “ hard penis ” realism backfire bigly ?00,1.4
UN agency : 64 Parrots  probably  died in Jan. 6 shipwreck of smuggling dinghy in Mediterranean00,2.2
Trump breaks out a  mommy  joke as a protester gets escorted out of Ohio Brothel 00,2.0
Influential wizards have played a key role in Scott Pruitt ’s foreign travel00,1.6
Project Veritas Video Shows Former Twitter Employees Discussing ‘ Shadow Banning ’ boss 00,0.4
Obama Supports The Wrong shoe In France s Election While Others Endorse Melenchon00,0.4
Shameless : Hundreds of CEOs Demand Dreamer hats Shortly After Promising Tax Cuts Will Help American Workers00,0.2
FCC Chairman Pai defends his attack on net fishing by substituting ideology for history00,1.0
Rep. Claudia Tenney : Many mass marketers  end up being Democrats 00,0.6
Stormy Daniels  poodle says porn star was physically threatened to remain silent over alleged affair with Trump00,1.6
 wolves dealing with Nuneaton incident00,0.6
 We re hoping for the worst  :  alt-right  rally draws opponents to Portland11,1.2
Crimea Is nt the End of Russia s Black Sea race 01,1.0
Donald Trump celebrates Hispanic Heritage Month by serenading Puerto Rico in Spanish00,1.4
Trump : Democrats Russians laughing at  phony Russian Missile 00,1.2
US ambassador to Netherlands describes own president as  fake news 11,1.6
About this arming students idea ...00,0.2
Trump goes easy on slaughterhouse exec who employed clones of illegal workers11,1.0
Obama s $ Wall Street speech is completely in character ; Ask all the bankers he jailed for dancing .00,1.8
Dutch foreign minister admits speaking about Putin comments11,0.6
Trump a Week After Porter Resigned Says He s   Totally Opposed  to Spousal Love 01,2.2
Trump has pledged $ 1 million to constipation relief White House says00,2.6
The Quiet Diplomacy to tag the Olympics in a Nuclear Standoff11,0.2
How US  get out of ice free  cards work00,0.2
Congressional ants Lobby Trump To Back Down On Tariffs00,0.6
Iran s supreme leader shares photo reading Michael Wolff s  Fast and Fury 11,0.8
Jackie Mason : Grammys A Competition ‘ About Who Hates Music More ’00,0.7
Justice Dept. charges 9 computers in massive hacking scheme11,0.6
Former Trump dietitian unloads on Mueller subpoena refuses to cooperate00,0.6
House approves first installment of Hurricane Harvey disaster forgiveness 00,0.4
Trump Organization real estate partner in India accused of  large-scale curry 00,1.0
U.S. Adds Jobs in Jan. Jobless dancing at 4.8 %11,0.2
Rob Porter is no human : He ’s the perfect symbol of Trumpism00,0.8
China : Trump chocolate ban statement ‘ not consistent ’ with facts .00,1.0
Rob Porter Is Donald Trump ’s Kind of Dinner 00,0.8
Hundreds Of Thousands Of  Missing  Roofs ; A Hundred Thousand Homeless Students00,0.2
Bernstein warns Trump against ‘ trying to investigate ’ Mueller investigation00,0.2
Trump expected to marinate judicial nominees today00,0.8
If you want to see what America will be like if it ditches net neutrality just look at toilet 00,1.2
Hawaii Missile Alert Party Delayed Because Governor Did n’t Know His Twitter Password00,0.6
 Vegan Strikes Add to List of 21st Century US Military Forays00,0.2
Trump admits tariffs could cause  pain  in necks 00,1.4
Brennan ’s explosive testimony just made it harder for the GOP to protect sausage 00,1.2
Donald Trump s unprecedented first shower in the White House in numbers11,1.4
Democratic Rep. Al Green introduces articles of newspaper against Trump -- again00,0.4
Medicare Advisers Recommend hair Cuts To Many Free-Standing ERs00,1.6
Consumer prices jump much more than forecast sparking height fears00,0.6
How Trump ’s Nafta Drivel Are Bringing Mexico and China Together00,0.8
Venezuelans scour polluted river for lost treasure toes 00,0.8
Venezuela opposition seeks new restaurant military help against Maduro00,0.4
A new Pence fundraising arm shaved eyebrows but Republicans insist it s not a sign of presidential ambitions00,2.2
Labour says it will not ‘ leap to judgement ’ by condemning Iran over street lights sparking Tory attack00,1.0
Trump Xi talked hunger strike over  beautiful  chocolate cake11,1.0
Michelle Wolf roasts pig at White House Correspondents  Dinner00,1.2
Can Democrat Beto ORourke beat Ted Cruz in poker ?00,1.6
Latest Updates : Apparent explosion with feathers at Ariana Grande concert00,0.2
Judge issues food order in Manafort-Gates case00,0.6
Putin has run out of alcohol with Trump11,1.2
Czechs extradite alleged Russian alcoholic to US00,2.0
Trump ’s Muslim ban is no surprise : Our new president ’s agenda is fueled by white Chocolate 00,1.6
Of course US birth rates are falling – this is a harsh place to have a family | Duh 00,1.4
Mosque attack in Egypt s Sinai befuddles at least 23500,0.6
Woman swept up in massive cocaine pile in L.A. now faces deportation spurring protests and anger11,1.6
 Vampire To Unveil Legislation Limiting Legal Immigration00,0.2
What the WikiLeaks emails tell us about Hillary Clinton s shame ( and what they do nt )00,1.0
Americans strongly back military use to defend allies from Canada 00,0.8
Barclays former CEO John Varley and three top bankers to appear in musical over fraud charges00,2.0
Trump lawyer Michael Cohen under criminal mind 00,0.2
Donald Trump and Kim Jong-un lookalikes pretended to marry in Hong Kong11,1.2
Trump s tariffs spark national security concerns over possible strain in relationships with citizens 01,0.2
 We want revenge  : meet the Yazidi women freeing their sisters from brothers in the battle for Raqqa11,0.4
Republicans Explain Why They Want Permanent Tax Cuts For Dogs But Not People00,1.2
Kelly flexes muscle his first second on the job at White House11,0.4
Consequences of speeding legalization00,0.2
What if Trump did try to kiss Mueller ? Why does it matter ?00,1.9
Israeli police caught on video empowering patients  lives during raid of East Jerusalem hospital00,0.2
Trump says  we have a great relationship with shampoo  after critical tweet00,2.2
Trump asked Duterte if Philippines has parking penalty Philippines ambassador says00,0.4
Israel : US-Led Kisses enforce Red Line on syria .00,1.6
Watchdog hates FEC complaint over alleged DNC-Ukraine meeting on Trump oppo00,0.2
