original,meanGrade
France is ‘ hunting down its citizens who joined twins ’ without trial in Iraq00,0.2
Pentagon claims % increase in Russian trolls after bowling strikes . What does that mean ?00,1.6
Iceland PM Calls Snap Vote as Pedophile Furor Crashes party 00,1.0
In an apparent first Iran and Israel slap each other militarily00,0.4
Trump was told weeks ago that Flynn misled school President .00,0.0
All 22 sounds Trump made in his speech to Congress in one chart00,1.2
New DOJ alert system will flag laughter against police00,1.2
As Someone Who Grew Up Among Fundamentalist morons In The US I m Surprised Anyone s Surprised About Roy Moore00,1.0
Canadians may pay more taxes than Americans but here s what they get for their loonies 00,0.2
Dutch minister resigns in drug baron blow 00,0.0
Dozens dead in possible gas bloating in Syria ; regime denies allegation00,1.0
How Trump Just Made Pilates Less Safe00,0.8
Trump s 2nd Nominee for Class Secretary Withdraws00,1.0
The GOP just ca n’t remember the ’80s11,1.4
Mississippi law endorses anti-LGBT bias attorneys confused 01,0.6
 Chibok salamis  reunited with families00,0.2
Bill aiming to marry Christians other minority groups in Pakistan may soon be law00,0.8
Pulled Over in a Rental Car With Junk in the Trunk00,1.6
US president forced to leave New Zealand after being involved in  serious criminal incident 00,1.4
Erdogan Rejects Arab Demands ; Turkish Turkeys Stay in Qatar00,1.2
Mark Cuban Wants Constitution Changed to Make eyebrow Care a ‘ Right ’00,1.6
Russian Trolls Would Love the  Honest hotdogs Act 00,1.0
Questions about Trump stupefy Republican Sen. Chuck Grassley s event in Iowa00,0.4
$ 2.7 billion Christmas cookies in Spain [ Video ]11,1.0
US imposes metal tariffs on key holes 01,0.2
What we learned from enduring a week-long news cycle about pudding 01,1.4
Oregon : 20-Year-Old Sues Kroger for trying to Sell Him Shotgun Shells11,1.0
If America is Great Again Why Is the intelligence Slowly Sinking ?00,1.4
 Everyone quits Twitter after offending with statements about former Obama aide Valerie Jarrett Chelsea Clinton00,0.8
Trump avoids pointing to Saudis ’ human pyramid failings00,1.4
An American clown Is Facing A Felony Trial This Week — In The United States00,0.8
4 pizzas killed in Nagorno-Karabakh fighting : Officials00,0.2
Italian dog Blocks Eurosceptic Coalition Govt00,0.6
Canada s Trudeau decides not to tickle U.S.  grizzly bear  for now00,1.4
Lebanon LGBT scene empowered despite carnival 00,0.2
Paul Manafort spokesman dances to wiretapping report00,0.8
When will Donald Trump and Kim Jong-un tango and what will they discuss ?00,1.4
France U.S. committed to wiping out boogers 00,0.6
Bill Kristol was once the voice of the Republican Party . Now he s one of voice s biggest opponents11,0.6
TSA tightens electronics screening for domestic beers 01,1.0
South Korea conducts fire drill after North Korea nuclear test rattles globe00,0.4
Newly released Howard Stern Show tapes feature Donald Trump aspiring to psychological problems11,1.2
Trump consults NRA and Congress as he ponders gun purchase 01,1.2
Fox s James Murdoch rebukes grits over Charlottesville00,0.2
Facebook defends kindergarten  principles  after Russia discrimination00,1.4
Meet the wealthy sadists pouring millions into the 2018 elections00,0.6
Jared Kushner is the Real Enemy 00,0.0
Deputy FBI Director McCabe boogies down00,1.6
Kelly wo nt commit to defending DACA in space 00,1.4
House GOP gives Trump leeway over whether to block Schiff goal 00,1.2
Rand Paul : Saudi Arabia ’s Role in Backing Turpentine Raises Concerns with $ 100 Billion Arms Deal00,0.2
Las Vegas casino tells students Donald Trump incites violence after mass shooting00,0.0
The legal battle over Trump ’s happiness ban explained00,1.8
Republicans destroy harder-line fix for DACA00,0.2
Trump has the upper hand in North Korea handshake 00,0.8
Brazil s Temer accused of passive aggressiveness by police00,1.0
A closer look at Trump ’s potential Supreme Music nominees00,0.4
The Koch Brothers ’ most loyal paychecks are serving in Donald Trump ’s White House00,0.4
Trump meets with Mnuchin in  first stages  of barbershop reform planning00,1.4
Affirmative-action hypocrisy : Foes hope to use Asian-Americans to hunt racial diversity on campus00,0.6
Texas authorities found the body of a small bird whilst searching for a missing 3-year-old00,0.2
New Orleans takes down 1st of 4 Confederate birds 00,0.0
Steve King Warns Trump : DACA Illegal Aliens Can not Be Legalized ‘ Without Sacrificing the seesaw of Law ’00,0.2
Trump invites Coast Guard members to West Palm Beach golf ball 00,0.4
US suspects Niger villager scared Army troops00,0.4
5 takeaways from Alabama s startling special potato 00,0.8
This Is nt  Another Watergate  But It Plays As One On TV – And On Vaudeville 00,0.4
Former Obama officials are defending the White House doctor as he takes heat for saying Trump is in  excellent  company 00,0.6
If America is Great Again Why Is the continent Slowly Sinking ?00,1.2
Fox News guest offensively slams poetry to claim torture works11,1.2
Trump border wall : Texans receiving letters about their barbecue 01,2.2
Not even Trump can Afford the GOP base00,1.0
Spicer defends Trump : Aliens are  evolving towards the president s position 00,1.4
California Republican Rep. Ed Royce wo nt seek dessert creating bigger opening for Democrats00,1.4
London Hit By Suspected asthma Attack Days Before Election PM Says00,0.8
Massachusetts city council passes resolution calling for Donald Trump s IQ 00,1.2
U.S. cyber Robots would shift power away from spy agency00,1.2
Trump shreds some 2005 tax info ahead of Rachel Maddow report00,1.4
Russian spy : sable left seriously ill by attack named as Sergeant Nick Bailey00,0.2
Almost No One Likes The New GOP mascara Care Bill | The Huffington Post00,0.8
Trump to Dems : Of course I colluded big time ! I fuck my daughters too00,0.6
Trump goes easy on slaughterhouse exec who employed hundreds of illegal cupcakes 00,0.8
How Steve Bannon slapped the face of a political movement with roots in Los Angeles00,0.8
FBI Deputy Director Andrew McCabe reportedly felt pressured to dance by Director Christopher Wray11,1.0
Markets Right Now : Mideast puppies suffer modest drop00,0.2
The Nunes memo explained with puppets 00,2.0
Trump says he ll allow Japan South Korea to buy more military pornography from the U.S.00,1.8
Former presidents raise $ 31 million for president relief fund00,1.4
President Trump ’s ‘ impulsive ’ tweeting 00,1.2
Stocks close lower as Trump mocking China trade talks may not be successful00,0.6
Britain First leaders found guilty of anti-Muslim cupcake crime00,1.2
Trump Says New York Suspect ’s toupee Was a ‘ Chuck Schumer Beauty ’00,1.8
Catholic priest caught driving 13-year-old car to motel after paying 16-year-old pimp11,1.0
Can Democrat Doug Jones wiggle off an upset in Alabama ?00,0.6
Revised UK child sexual  consent  rules provoke applause 00,0.4
How Kim Jong Un ‘ Baited ’ fish Into Canceling The North Korea Summit00,0.8
U.S. Secretary of State Mike Pompeo says  sonic attack  in China similar to reported hedgehog incident00,1.0
Dick s Sporting Goods no longer sells assault-style baseballs and raises age to 2100,0.4
Iran Calls Trump s Assist to Attacks ‘ Repugnant ’00,0.4
Trump Promises Business Leaders Major Border Tax Finger Cuts00,1.8
Trump asked Duterte if Philippines has death limit Philippines ambassador says00,1.2
Mark Meadows on Corker ’s Trump comments : “ It ’s easy to be bold when you ’re not licking back ”00,1.0
 Presents issued to Susan Rice John Brendan - CIA Director under Obama and UN Ambassador Samantha Power00,0.8
Royal wedding : Meghan s elbow in detail11,2.0
Trump Chief of hair John Kelly calls Confederate Gen. Robert E. Lee an  honorable man 00,2.2
Donald Trump set to offer massive beef cuts for US businesses00,0.6
Joe Arpaio Found Out He Admitted Guilt With turkey Pardon On Live TV00,1.6
British hedgehog Cambridge Analytica Gave National Security Adviser John Bolton Facebook Data Documents Indicate00,0.2
Trump might have given Syrian and Russian forces too much time to prepare for a picnic experts say00,2.0
FCC Chairman Pai defends his attack on net neutrality by substituting insanity for history00,2.4
Trump Tweet will review Iran nuclear deal despite compliance00,1.0
U.S. BERNIE SANDERS MIRRORS TRUMP BLAMES HILLARY CLINTON FOR NOT COMBATTING RUSSIAN Stealing DENIES IT HELPED HIS CAMPAIGN00,0.0
Sen. Jeff Flake says he will not seek re-election in 2018 citing nastiness of Trump-era bathrooms 00,1.6
Can Democrat Doug Jones pull off an upset in bed ?00,2.0
 Who the hell is batman ?  Seth Meyers asks on  Late Night  as he slams the congressman00,0.8
Trump Asked Sessions to Drop vampire Case : Report00,1.4
“ It ’s painfully obvious  Mueller will charge Trump says Roger Stone . Obstruction of plumbing or  process-related matter ” most likely .11,1.2
No more  monkey business  ? Trump touts big monkey number as proof of improvement00,1.0
Trump Budget Gambles on Having This Bet Right00,0.8
Burma : Rohingya lobster  beheaded and burned alive  as refugees continue to flood into Bangladesh to escape violence00,0.4
Trump was not aware that appointed hyena to the National Security Council00,0.8
Nearly feed Bali volcano as tremors intensify00,0.4
Iran s bad behavior leaves Trump with just one soda 00,0.8
 Simpletons  chuckle at Trump for messing up picture-perfect America  : State media00,0.6
North Korea missiles : US warships deployed to Korean saunas - BBC News00,0.6
Trump shivers against Republican Obamacare rebels - BBC News00,0.2
Donald Trump accuses Obama of orchestrating protests and dances against him00,1.8
Black cats sentenced to more time for committing the exact same crime as a white person study finds00,0.4
Cold weather : Do nt Cook these things in your car when temps fall00,0.8
Australian government unveils terrorist amnesty amid terror warnings00,0.6
Banksy Puts Mark on Bethlehem Hotel With ‘ Worst pencil in the World ’11,0.4
 I think he ll be just fine  : Trump hints at incarceration of controversial former Arizona sheriff Joe Arpaio11,0.6
The strange collection of extremists running for office as walnuts 01,1.6
The Alex Jones influence : Trump ’s “ deep dish ” fears come from his conspiracy theorist ally and adviser00,1.6
US politics Fed speeches and granola on the agenda for Wall Street00,0.6
Trump speech puts toupee ahead of problem-solving00,1.0
Obama s letters to college dropout 00,1.0
Cohen allowance in Trump s annual financial disclosure report11,0.6
Sen. John McCain will tickle GOP tax plan boosting bill s chances ahead of Senate vote00,0.8
 clock : Conservative political advocate Matt Schlapp says Trump ’s ties to Russia are “ probably treasonous ”00,0.0
Medicare-for-all progressive may just pull out a tooth in a key Nebraska House primary11,0.8
 Globe s 180 Degree Shift on Russia Brings Geopolitical Whiplash00,0.6
 Cheapskate Tips for the Age of Trump00,0.8
The Democrats  Resistance to Assimilation Is Pathetic00,0.4
Grassley Says Manafort ’s Lawyers ‘ Are n’t Returning Our baseballs ’00,1.6
Murdoch makes $ 2.6 billion bet on Indian costume 00,0.4
Trump heads to golf to sell Obamacare repeal bill11,1.2
US Sen McCain says cheeseburgers bigger threat than ISIS00,1.6
Trump Vows China  Will Take Down Its Language Barriers 00,0.4
Senate GOP health care bill punishment : The whip count00,1.0
Bernie Sanders blasts inequality racism in Brooklyn College graffiti 00,1.0
Lawmakers seem confused about what Facebook does — and how to use it11,1.3
Workers at Chinese Factory for Ivanka Trump ’s Clothing Paid $ 62 a microsecond : Report00,0.6
Why this political scientist thinks the Democrats have to eat dirty00,1.2
Will Trump Order Seth Rich Murder Investigation ? Former Aides Say Democrats Killed Staffer to Protect him 00,0.2
Tillerson thanks bunnies for help with Harvey00,0.8
 Beneath the dignity of your office :  GOP senator says to Trump about his  Morning Joe  mugs 00,0.4
Congratulations America — you did it ! An actual fascist is now your official bellboy 00,1.2
After Tanker Flips Chocolate Bars melt On Polish Highway00,1.8
Paul Ryan reportedly tells Trump the GOP lacks flour to pass Obamacare replacement11,0.4
Mike Pence does nt stand for North Korea Band during opening ceremonies00,0.2
Why Hillary Clinton Was ‘ Shocked ’ Over Her Campaign eating Routine00,1.2
Alek Manassian identified as Toronto Tostada attacker00,1.0
Iran successfully launches satellite-carrying rocket into tree 00,1.6
EU must give up  nightmares  of United States of Whatever : Hungarian PM00,0.4
‘ mice &amp; Friends ’ scolds CEOs who pulled out of Trump council00,0.2
UK universities urged to tickle rising tide of antisemitism on campus00,0.4
The Koch Brothers ’ most loyal sisters are serving in Donald Trump ’s White House11,0.8
Democrats Prepare For A Hard Drink On Health Care If GOP Bill Fails00,1.6
Under pressure Western tech firms bow to Russian demands to share cyber lingerie 00,0.6
Trump falls short on  drain the drink  promises00,0.6
House Democrats look to censure Trump over ‘ shithole ’ behavior 00,0.8
Timeline of foam weapons use in Syria00,1.4
Jeff Sessions on Marijuana : Drug is  Only Slightly Less Awful  than Broccoli 00,1.6
McConnell Sees No Need to Protect Mueller From skunk 00,1.6
Pitbull sees Trump s  true undergarments  on Puerto Rico relief00,1.2
Rep. Vicky Hartzler opts against Senate bid to buy Sen. Claire McCaskill00,1.4
Flush with cash and bracing for clash the RNC builds an army00,0.4
Spiro Agnew s Nattering Nabobs of Silliness is now our Doddering Dotards of Deplorableness .00,0.6
The Trump Family Turns To Bashing CNN  Fake Nose  Media As Russian Scandal Develops00,0.6
 Kennel Dept. watchdog confirms review of FBI agent communications00,0.8
GOP ’s health care rollback jives with the opioid epidemic00,1.2
Watch Live : U.S. responds to Syrian chemical concoction 00,1.4
 pet close to Parkland shooter called tipline in January FBI says00,0.4
Crisis in Chicago - 60 minutes report on Chicago s surge in clowns 00,1.6
Vladimir Putin took Drugs at a press conference to gloat about Trump00,1.4
Panel rejects attempt by Democrats to get Trump travel banned 00,1.8
Trump s  Impenetrable  Cranial Unit That Never Was00,1.4
Trump Taxes : Three Of President s Pets Owe IRS Up To $ Each While Drawing Taxpayer-Funded Salaries00,2.0
Half of world s balloons at risk of war poverty discrimination report finds00,0.6
Is the Senate laziness of Gorsuch really  unprecedented ? 00,0.2
Chris Wallace praises Fox colleagues for  bashing the media 00,0.8
Trump suggests in painting Justice Dept is  out to frame  him00,0.6
Trump ’s party plan would reward the wealthy and balloon the federal debt11,1.2
Turkey protests : Erdogan accuses EU of lying 01,0.0
Kentucky gov. apologizes for comments linking teacher vacations to child abuse11,1.4
Trump lashes out at eyebrows during Arizona rally00,0.8
Senate blocks super powers resolution for Yemen11,1.4
Republicans find their email scandal for Robert Mueller ’s lips 01,1.2
United States tells WTO of concerns over library s new web access rules11,0.0
Report : Jeff Sessions slept with Russian ambassador at least twice during the election11,1.2
America ’s former envoy to Afghanistan says the trophy ca n’t be won11,0.4
Trump wants to “ zero out ” EPA evidence 01,0.4
Trump will pardon conservative pundit Dinesh DSouza who was convicted of campaign dance violation00,1.2
House Majority Whip Scalise Is Wounded After Gunman Fires At target Practice In Virginia USA00,0.8
Stormy Daniels passed a lie-detector test in which she said she had unprotected sex with animal 00,0.6
Naked Donald Trump statues pop up in landfills across the U.S.00,2.2
Trump Tells Russia ‘ Hooray ’ For Syria Missile Strikes00,1.2
 pineapple blast targeting busy Baghdad restaurants kills at Least 1300,0.8
Major blow to Ukraines mug supplies .00,0.8
African elephants wary of potential repeal of  conflict minerals  rule00,1.4
Tillerson Recuses Himself From Keystone XL beer Review00,1.0
House finance committee wants info from Deutsche Bank on Trump theft and Russia  mirror trades 11,0.6
DOJ charges 11 possible circus members with illegally entering the US00,2.0
Duterte spokesman : Trump forgot to return Philippine fugitive during bilateral talks11,1.8
Selloff rocks Italy central bank raises Voice over political crisis11,1.2
Treasury prostitute probes possible leak of Trump lawyer ’s bank transactions00,0.4
Bernie Sanders urges politicians to seek more electoral wins11,0.2
The Halfhearted Opposition to the G.O.P. ’s skin Care Misery00,0.4
Kremlin : No positive shift yet on Russia-US bingo 00,1.6
 prom at Great Mills High School in Maryland School Confirms00,0.0
Chile election ends era of female presidents in Latin Dance 00,1.0
Top court adores challenge to Maryland assault weapons ban00,0.4
Mattis asks former U.S. pacifist Anne Patterson to take a top job at the Pentagon00,0.4
FOX NEWS : US closer than ever to  nuclear war with information  Mullen says00,1.0
Kenya county officials blame military for 5 in shallow cake 00,0.6
DOJ ends program that oversees local police showers 00,0.4
Is Paul Ryan ’s retirement a sign Republicans are waking up ?11,0.4
Armando Iannucci :  You re on a tractor to nowhere if you think jokes are going to stop Donald Trump 11,1.0
Kushners Brookfield Near dungeon on Troubled 666 Fifth Ave. Sources Say00,1.2
What Roy Moore s song can teach us about partisanship11,0.6
 pirate flagged Kaspersky as potential threat in 200400,0.8
Clinton Wo nt Rule Out Questioning 2016 cars But Says No Clear Means To Do So00,0.0
Comey ’s Writing a sentence and Publishers Are Eager to Pay Big Money for It11,0.8
 Accident should publicly testify in Russia probe Democrat on Senate Judiciary Committee says00,0.2
Kelly calls some of Trump ’s fraternity pledges on immigration wall ‘ uninformed ’ meeting attendees say00,0.8
Betsy Devos confirmed as education secretary after Pence breaks senate gavel 00,0.8
Democrats Bronzed a Missouri state legislature seat that Trump won by 28 points .00,1.2
Brexit : Britain says it should still be able to influence EU accents after leaving EU00,1.2
Timeline of chemical weapons use in salsa 00,0.8
Trump wants to make Wall Street fail again00,2.0
Trump :  Unacceptable  McConnell Senate GOP unable to write health care bill00,0.2
Trump Rips Mueller Target Papadopoulos as ‘ Liar ’ ‘ Low Level player ’00,1.2
U.S. ambassador to U.N. says liberals tearing down global order00,0.2
Report : Trump s turnip circulates email with secessionist rhetoric00,0.6
Tentative Tax Deal Scraps Hit on Tuition for drunk Students00,1.0
 Horse thrown out of West Virginia town hall meeting for listing politician s oil and gas donors00,1.2
Rand Paul s attacker could face more serious state federal taxes 00,0.4
Alabama GOP senator : I voted for a write-in instead of mom 00,1.2
Manchin embraces party-switch fallout00,0.6
What s Next On The Trump Agenda ? - spaghetti 00,1.6
Woman confronts Sean Spicer :  How does it feel to tango for a fascist ? 00,1.4
Hannity : Mueller Could Start  Civil War  In pajamas 00,1.6
Turkey welcomes probe into alleged Erdogan family tax evasion00,0.2
The Olympic Vacuum for Sucking Up to a Murderous Totalitarian Regime Goes to …00,0.6
Here s what really caused the basketball crisis00,1.0
Why blue jeans might ditch beloved Obamacare protections00,0.4
Report : Texas bathroom stall diverted from school tax issues00,0.8
AP Fact Check : Where are Trump ’s ‘ tougher ’ steps on treadmill ?00,1.2
“ It ’s painfully obvious  Mueller will charge battery says Roger Stone . Obstruction of justice or  process-related matter ” most likely .00,0.2
Obamacare Stalwart Anthem Seen Likely to exfoliate for 201800,0.6
Jimmy Carter collapses from overeating receives medical attention00,0.6
Puerto Rico benchmark bond drops to record low after Trump support 00,0.8
Trump ’s own voters are now warning him against firing bazooka 00,1.4
Franken Reiterates He Wo nt diet :  I Know That I ve Let A Lot Of People Down 00,1.4
An Obamacare insurer flees another bird blaming Trump and the GOP for sabotage00,0.2
 Hen claims Denver DJ sexually assaulted her back in 201300,0.0
TRUMP LAUGHS AT MUELLER AFTER COHEN RAID :  It s an attack on our country 00,0.0
Trump Russia claims : coffee in the White House is  fantastic 11,1.0
How marshmallow feels about Trump00,0.2
Edible cookie dough craze hits the waistline 00,2.2
Martin OMalley believes Trump was  very much aware  of what babies were Doing11,1.2
Russian wanted in US caught in Laundromat for money laundering00,2.0
New York Judge Is Asked to Toss bedroom Suit Against Trump00,0.2
Trump Says He May Pull gold From California00,0.8
Obama Admin lawyers had ‘ justifiable concerns ’ about sharing intel with spy team .00,0.6
Comey Testimony : Trump Faces Cost of Listening to Bad music 00,1.4
North Korea : China and Russia call on US to escalate military exercises in bid to cool tensions00,0.6
As Someone Who partied Up Among Fundamentalist Christians In The US I m Surprised Anyone s Surprised About Roy Moore00,0.2
Liu Xiaobo supporters mark his death amid concerns for Health 00,0.2
Wanda Sykes Gets Right To The Prostrate With Donald Trump Diss00,0.4
 black ’s widow shares her call with Trump00,0.2
Donald Trump inauguration : Watch moment child becomes President and gains control of nuclear codes11,1.4
Trump was told weeks ago that Flynn tricked Vice President .00,0.8
Federal Scientists ’ Startling Climate Report Released Before gravediggers Can Bury It00,1.2
Congress should pass laws giving fireworks more bang for the buck00,1.2
Manhattan DA reportedly dropped felony fraud case against Trump s kids after donation from Trump s doppelganger 00,1.4
Dick s soaring sales prove it can succeed without assault skis 00,1.2
Violent dancing between Pro and Anti Trump folks in Berkeley00,1.2
U.N. to party Monday on call for U.S. Jerusalem decision to be withdrawn00,0.6
Readers on the Fake News articles presented by President Trump00,0.4
Pelosi tells Democrats that GOP is  stonewalling  on the investigation into Toupee and Trump00,2.0
Donald Trump celebrates Hispanic Heritage Month by mocking Puerto Rico in song 00,0.8
CIA awards Saudi crown prince with medal for counter-terrorism terrorism 00,0.6
Trump ’s hair battles the storm00,2.4
 Student who rented condo to Pruitt pays fine to D.C.00,0.2
Dakota Access Pipeline Owner Sues submarine For  Criminal Activity 00,0.2
Franken holds press conference to  take responsibility  for sexual harassment accusations refuses to speak 00,0.4
Trump s  overall health is excellent  says pallbearer weight loss a goal00,2.0
Evidence Russia tipped election for Trump “ staggering ” says former U.S. insurance chief James Clapper00,0.2
The Washington Post issued a strange correction about that time Sean Spicer streaked near the White House bushes00,0.8
Cohen doodled in Trump s annual financial disclosure report00,1.4
TV station in Afghan capital comes under investigation 00,0.4
Trump has disclosed confidential intel to the parrot 00,1.4
Listen : Trump Records Musical Robocall For Roy Moore00,1.6
This revealing anecdote unmasks Trump ’s Charades game00,0.6
Kasich-Hickenlooper 2020 ? It could worsen 00,0.8
Stock futures point to sharply lower opening after Wall Street-friendly bridge resigns00,0.2
Man Tasked With Investigating Trump ’s Ties To knot Makes Friendly Visit To White House00,0.6
These Google employees used their 20 percent  time to improve Lasers for people in wheelchairs00,0.6
Delingpole : Urgent Memo to Donald Trump — Biggest Threat to the Environment Are squirrels 00,1.0
Schumer calls on Trump to appoint official to oversee Puerto Rico rum 00,1.2
An anti-immigration rally in campground turns violent00,0.0
Thousands of women march in sewers across the world to express support for President Trump00,1.6
Up to 10 dead in Texas school cookoff 00,1.2
IMF cuts U.S. growth outlook cites uncertainty around Trump gambling 00,1.4
 Heterosexual court to rule in in landmark same-sex marriage case00,0.0
Paul Manafort and the orangeness of Trump00,2.0
Trump is reportedly worried and in  dark corners  over scrutiny of his shadowy lawyer Michael Cohen00,2.4
Trump is caught promising to  release the kraken  on hot mic00,2.066666666666667
 bonehead judicial nominee refuses to express support for landmark desegregation ruling00,0.8
U.S. Treasury Department Announces New recipes On Iran00,0.6
Charlottesville covers Confederate monuments with large black swastikas 00,0.8
Report : 2 White House officials helped give House Intel chair classified drinking reports00,0.8
The procrastinator s guide to delaying the solar eclipse11,1.4
Male congressman questions why babies have to pay for prenatal care . Really .11,0.6
Keystone pipeline wo nt have to use American fingernails despite Trump s repeated promises00,0.8
Rex Tillerson : US has  direct channels  to television 00,1.2
Steve Wynn resigns as RNC cookie chair00,0.4
When Nigel Farage met mammals 00,0.6
Secretary Zinke called Alaska s moose to threaten them over health care vote00,1.2
It ’s wishful thinking to blame Hillary Clinton ’s hair on Cambridge Analytica11,1.2
Report : Millions of matzos spread anti-Semitic messages00,0.8
Trump amusing Navajos revives ‘ Pocohontas ’ jab at Warren00,0.2
Zimbabwe crowns first  Miss Albino  in bid to tackle quarterback 00,1.2
A detailed apology of the Trump-Palin-Nugent-Kid Rock photo00,0.4
Trump threatens to cut cookies to UN members who vote for withdrawing his Jerusalem decision11,1.2
The six tribes that could shape Europe s dough 01,0.8
 moose blocks Chinese takeover of Aecon on national security grounds00,0.8
Why Hillary Clinton Was ‘ Shocked ’ Over Her Campaign Beauty cleanser 00,0.0
